"Cites","Authors","Title","Year","Source","Publisher","ArticleURL","CitesURL","GSRank","QueryDate","Type","DOI","ISSN","CitationURL","Volume","Issue","StartPage","EndPage","ECC","CitesPerYear","CitesPerAuthor","AuthorCount","Age","Abstract"
21,"E. Ambrosini","Functional and usability assessment of a robotic exoskeleton arm to support activities of daily life",2014,"Robotica",NA,"https://www.scopus.com/inward/record.uri?partnerID=HzOxMe3b&scp=84927697037&origin=inward","https://www.scopus.com/inward/citedby.uri?partnerID=HzOxMe3b&scp=84927697037&origin=inward",99,"2021-03-18 10:43:54","Article","10.1017/S0263574714001891","0263-5747","https://api.elsevier.com/content/abstract/scopus_id/84927697037",32,8,1213,1224,21,3,21,1,7,NA
21,"Y. Suh","Social Cognitive Predictors of Physical Activity in Relapsing-Remitting Multiple Sclerosis",2014,"International Journal of Behavioral Medicine",NA,"https://www.scopus.com/inward/record.uri?partnerID=HzOxMe3b&scp=84912044582&origin=inward","https://www.scopus.com/inward/citedby.uri?partnerID=HzOxMe3b&scp=84912044582&origin=inward",100,"2021-03-18 10:43:54","Article","10.1007/s12529-013-9382-2","1070-5503","https://api.elsevier.com/content/abstract/scopus_id/84912044582",21,6,891,898,21,3,21,1,7,NA
21,"O. Geman","Automatic assessing of tremor severity using nonlinear dynamics, artificial neural networks and neuro-fuzzy classifier",2014,"Advances in Electrical and Computer Engineering",NA,"https://www.scopus.com/inward/record.uri?partnerID=HzOxMe3b&scp=84894623357&origin=inward","https://www.scopus.com/inward/citedby.uri?partnerID=HzOxMe3b&scp=84894623357&origin=inward",101,"2021-03-18 10:43:54","Article","10.4316/AECE.2014.01020","1582-7445","https://api.elsevier.com/content/abstract/scopus_id/84894623357",14,1,133,138,21,3,21,1,7,NA
21,"R. Motl","Reliability of physical-activity measures over six months in adults with multiple sclerosis: Implications for designing behavioral interventions",2014,"Behavioral Medicine",NA,"https://www.scopus.com/inward/record.uri?partnerID=HzOxMe3b&scp=84894149737&origin=inward","https://www.scopus.com/inward/citedby.uri?partnerID=HzOxMe3b&scp=84894149737&origin=inward",102,"2021-03-18 10:43:54","Article","10.1080/08964289.2013.821966","0896-4289","https://api.elsevier.com/content/abstract/scopus_id/84894149737",40,1,29,33,21,3,21,1,7,NA
21,"S. Sonenblum","Distinct tilting behaviours with power tilt-in-space systems",2011,"Disability and Rehabilitation: Assistive Technology",NA,"https://www.scopus.com/inward/record.uri?partnerID=HzOxMe3b&scp=79958224434&origin=inward","https://www.scopus.com/inward/citedby.uri?partnerID=HzOxMe3b&scp=79958224434&origin=inward",103,"2021-03-18 10:43:54","Article","10.3109/17483107.2011.580900","1748-3107","https://api.elsevier.com/content/abstract/scopus_id/79958224434",6,6,526,535,21,2.1,21,1,10,NA
21,"R. Motl","Association between change in physical activity and short-term disability progression in multiple sclerosis",2011,"Journal of Rehabilitation Medicine",NA,"https://www.scopus.com/inward/record.uri?partnerID=HzOxMe3b&scp=79953287028&origin=inward","https://www.scopus.com/inward/citedby.uri?partnerID=HzOxMe3b&scp=79953287028&origin=inward",104,"2021-03-18 10:43:54","Article","10.2340/16501977-0782","1650-1977","https://api.elsevier.com/content/abstract/scopus_id/79953287028",43,4,305,310,21,2.1,21,1,10,NA
20,"L. Pilutti","Weight status in persons with multiple sclerosis: Implications for mobility outcomes",2012,"Journal of Obesity",NA,"https://www.scopus.com/inward/record.uri?partnerID=HzOxMe3b&scp=84877276284&origin=inward","https://www.scopus.com/inward/citedby.uri?partnerID=HzOxMe3b&scp=84877276284&origin=inward",105,"2021-03-18 10:43:54","Article","10.1155/2012/868256","2090-0708","https://api.elsevier.com/content/abstract/scopus_id/84877276284",2012,NA,NA,NA,20,2.22,20,1,9,NA
19,"R. Motl","Objective monitoring of physical activity behavior in multiple sclerosis",2010,"Physical Therapy Reviews",NA,"https://www.scopus.com/inward/record.uri?partnerID=HzOxMe3b&scp=84865799027&origin=inward","https://www.scopus.com/inward/citedby.uri?partnerID=HzOxMe3b&scp=84865799027&origin=inward",106,"2021-03-18 10:43:54","Article","10.1179/174328810X12814016178953","1083-3196","https://api.elsevier.com/content/abstract/scopus_id/84865799027",15,3,204,211,19,1.73,19,1,11,NA
19,"S. Scott","Surface EMG characteristics of people with multiple sclerosis during static contractions of the knee extensors",2011,"Clinical Physiology and Functional Imaging",NA,"https://www.scopus.com/inward/record.uri?partnerID=HzOxMe3b&scp=78650138747&origin=inward","https://www.scopus.com/inward/citedby.uri?partnerID=HzOxMe3b&scp=78650138747&origin=inward",107,"2021-03-18 10:43:54","Article","10.1111/j.1475-097X.2010.00972.x","1475-0961","https://api.elsevier.com/content/abstract/scopus_id/78650138747",31,1,11,17,19,1.9,19,1,10,NA
17,"Q. Wang","Literature review on wearable systems in upper extremity rehabilitation",2014,"2014 IEEE-EMBS International Conference on Biomedical and Health Informatics, BHI 2014",NA,"https://www.scopus.com/inward/record.uri?partnerID=HzOxMe3b&scp=84906875128&origin=inward","https://www.scopus.com/inward/citedby.uri?partnerID=HzOxMe3b&scp=84906875128&origin=inward",108,"2021-03-18 10:43:54","Conference Paper","10.1109/BHI.2014.6864424","","https://api.elsevier.com/content/abstract/scopus_id/84906875128",NA,NA,551,555,17,2.43,17,1,7,NA
17,"R. Motl","Validity of minimal clinically important difference values for the multiple sclerosis walking scale-12?",2014,"European Neurology",NA,"https://www.scopus.com/inward/record.uri?partnerID=HzOxMe3b&scp=84892729641&origin=inward","https://www.scopus.com/inward/citedby.uri?partnerID=HzOxMe3b&scp=84892729641&origin=inward",109,"2021-03-18 10:43:54","Article","10.1159/000356116","0014-3022","https://api.elsevier.com/content/abstract/scopus_id/84892729641",71,3,196,202,17,2.43,17,1,7,NA
17,"Y. Baram","Virtual sensory feedback for gait improvement in neurological patients",2013,"Frontiers in Neural Circuits",NA,"https://www.scopus.com/inward/record.uri?partnerID=HzOxMe3b&scp=84874698218&origin=inward","https://www.scopus.com/inward/citedby.uri?partnerID=HzOxMe3b&scp=84874698218&origin=inward",110,"2021-03-18 10:43:54","Review","10.3389/fncir.2013.00039","1662-5110","https://api.elsevier.com/content/abstract/scopus_id/84874698218",NA,NA,NA,NA,17,2.13,17,1,8,NA
17,"S. Coote","Comparative validity of accelerometer-based measures of physical activity for people with multiple sclerosis",2012,"Archives of Physical Medicine and Rehabilitation",NA,"https://www.scopus.com/inward/record.uri?partnerID=HzOxMe3b&scp=84867840302&origin=inward","https://www.scopus.com/inward/citedby.uri?partnerID=HzOxMe3b&scp=84867840302&origin=inward",111,"2021-03-18 10:43:54","Article","10.1016/j.apmr.2012.05.010","0003-9993","https://api.elsevier.com/content/abstract/scopus_id/84867840302",93,11,2022,2028,17,1.89,17,1,9,NA
17,"H. Journee","Intraoperative neurophysiological assessment of disabling symptoms in DBS surgery",2007,"Neurophysiologie Clinique",NA,"https://www.scopus.com/inward/record.uri?partnerID=HzOxMe3b&scp=36849007087&origin=inward","https://www.scopus.com/inward/citedby.uri?partnerID=HzOxMe3b&scp=36849007087&origin=inward",112,"2021-03-18 10:43:54","Article","10.1016/j.neucli.2007.10.006","0987-7053","https://api.elsevier.com/content/abstract/scopus_id/36849007087",37,6,467,475,17,1.21,17,1,14,NA
16,"B.M. Sandroff","Physical activity is associated with cognitive processing speed in persons with multiple sclerosis",2014,"Multiple Sclerosis and Related Disorders",NA,"https://www.scopus.com/inward/record.uri?partnerID=HzOxMe3b&scp=84884291170&origin=inward","https://www.scopus.com/inward/citedby.uri?partnerID=HzOxMe3b&scp=84884291170&origin=inward",113,"2021-03-18 10:43:54","Article","10.1016/j.msard.2013.04.003","2211-0348","https://api.elsevier.com/content/abstract/scopus_id/84884291170",3,1,123,128,16,2.29,16,1,7,NA
16,"D. Dlugonski","Possible antecedents and consequences of self-esteem in persons with multiple sclerosis: Preliminary evidence from a cross-sectional analysis",2012,"Rehabilitation Psychology",NA,"https://www.scopus.com/inward/record.uri?partnerID=HzOxMe3b&scp=84861747675&origin=inward","https://www.scopus.com/inward/citedby.uri?partnerID=HzOxMe3b&scp=84861747675&origin=inward",114,"2021-03-18 10:43:54","Article","10.1037/a0027176","0090-5550","https://api.elsevier.com/content/abstract/scopus_id/84861747675",57,1,35,42,16,1.78,16,1,9,NA
16,"L. Klassen","An exploratory study of two measures of free-living physical activity for people with multiple sclerosis",2008,"Clinical Rehabilitation",NA,"https://www.scopus.com/inward/record.uri?partnerID=HzOxMe3b&scp=41549103712&origin=inward","https://www.scopus.com/inward/citedby.uri?partnerID=HzOxMe3b&scp=41549103712&origin=inward",115,"2021-03-18 10:43:54","Article","10.1177/0269215507082740","0269-2155","https://api.elsevier.com/content/abstract/scopus_id/41549103712",22,3,260,271,16,1.23,16,1,13,NA
16,"R.W. Motl","Are Physical Activity and Symptoms Correlates of Functional Limitations and Disability in Multiple Sclerosis?",2007,"Rehabilitation Psychology",NA,"https://www.scopus.com/inward/record.uri?partnerID=HzOxMe3b&scp=37649002364&origin=inward","https://www.scopus.com/inward/citedby.uri?partnerID=HzOxMe3b&scp=37649002364&origin=inward",116,"2021-03-18 10:43:54","Article","10.1037/0090-5550.52.4.463","0090-5550","https://api.elsevier.com/content/abstract/scopus_id/37649002364",52,4,463,469,16,1.14,16,1,14,NA
16,"M.H. Morgan","Intention tremor: a method of measurement",1975,"Journal of Neurology Neurosurgery and Psychiatry",NA,"https://www.scopus.com/inward/record.uri?partnerID=HzOxMe3b&scp=0016793196&origin=inward","https://www.scopus.com/inward/citedby.uri?partnerID=HzOxMe3b&scp=0016793196&origin=inward",117,"2021-03-18 10:43:54","Article","10.1136/jnnp.38.3.253","0022-3050","https://api.elsevier.com/content/abstract/scopus_id/0016793196",38,3,253,258,16,0.35,16,1,46,NA
15,"B. Sandroff","Physical activity and information processing speed in persons with multiple sclerosis: A prospective study",2013,"Mental Health and Physical Activity",NA,"https://www.scopus.com/inward/record.uri?partnerID=HzOxMe3b&scp=84890120892&origin=inward","https://www.scopus.com/inward/citedby.uri?partnerID=HzOxMe3b&scp=84890120892&origin=inward",118,"2021-03-18 10:43:54","Article","10.1016/j.mhpa.2013.08.001","1755-2966","https://api.elsevier.com/content/abstract/scopus_id/84890120892",6,3,205,211,15,1.88,15,1,8,NA
15,"R. Motl","Does a waist-worn accelerometer capture intra- and inter-person variation in walking behavior among persons with multiple sclerosis?",2010,"Medical Engineering and Physics",NA,"https://www.scopus.com/inward/record.uri?partnerID=HzOxMe3b&scp=78449232300&origin=inward","https://www.scopus.com/inward/citedby.uri?partnerID=HzOxMe3b&scp=78449232300&origin=inward",119,"2021-03-18 10:43:54","Article","10.1016/j.medengphy.2010.08.015","1350-4533","https://api.elsevier.com/content/abstract/scopus_id/78449232300",32,10,1224,1228,15,1.36,15,1,11,NA
15,"L. Hale","Reliability of RT3 accelerometer for measuring mobility in people with multiple sclerosis: Pilot study",2007,"Journal of Rehabilitation Research and Development",NA,"https://www.scopus.com/inward/record.uri?partnerID=HzOxMe3b&scp=34548075037&origin=inward","https://www.scopus.com/inward/citedby.uri?partnerID=HzOxMe3b&scp=34548075037&origin=inward",120,"2021-03-18 10:43:54","Article","10.1682/JRRD.2005.09.0155","0748-7711","https://api.elsevier.com/content/abstract/scopus_id/34548075037",44,4,619,627,15,1.07,15,1,14,NA
14,"B. Sandroff","Comparison of ActiGraph activity monitors in persons with multiple sclerosis and controls",2013,"Disability and Rehabilitation",NA,"https://www.scopus.com/inward/record.uri?partnerID=HzOxMe3b&scp=84875943000&origin=inward","https://www.scopus.com/inward/citedby.uri?partnerID=HzOxMe3b&scp=84875943000&origin=inward",121,"2021-03-18 10:43:54","Article","10.3109/09638288.2012.707745","0963-8288","https://api.elsevier.com/content/abstract/scopus_id/84875943000",35,9,725,731,14,1.75,14,1,8,NA
14,"J.E. Deutsch","Virtual reality and gaming systems to improve walking and mobility for people with musculoskeletal and neuromuscular conditions",2009,"Studies in Health Technology and Informatics",NA,"https://www.scopus.com/inward/record.uri?partnerID=HzOxMe3b&scp=70349578818&origin=inward","https://www.scopus.com/inward/citedby.uri?partnerID=HzOxMe3b&scp=70349578818&origin=inward",122,"2021-03-18 10:43:54","Conference Paper","10.3233/978-1-60750-018-6-84","0926-9630","https://api.elsevier.com/content/abstract/scopus_id/70349578818",145,NA,84,93,14,1.17,14,1,12,NA
14,"E. Gibbs","A biosensor-based characterization of the affinity maturation of the immune response against interferon-β and correlations with neutralizing antibodies in treated multiple sclerosis patients",2008,"Journal of Interferon and Cytokine Research",NA,"https://www.scopus.com/inward/record.uri?partnerID=HzOxMe3b&scp=57149120376&origin=inward","https://www.scopus.com/inward/citedby.uri?partnerID=HzOxMe3b&scp=57149120376&origin=inward",123,"2021-03-18 10:43:54","Article","10.1089/jir.2008.0144","1079-9907","https://api.elsevier.com/content/abstract/scopus_id/57149120376",28,12,713,723,14,1.08,14,1,13,NA
13,"E. Hubbard","Sedentary behavior is associated with disability status and walking performance, but not cognitive function, in multiple sclerosis",2014,"Applied Physiology, Nutrition and Metabolism",NA,"https://www.scopus.com/inward/record.uri?partnerID=HzOxMe3b&scp=84961288308&origin=inward","https://www.scopus.com/inward/citedby.uri?partnerID=HzOxMe3b&scp=84961288308&origin=inward",124,"2021-03-18 10:43:54","Article","10.1139/apnm-2014-0271","1715-5312","https://api.elsevier.com/content/abstract/scopus_id/84961288308",40,2,203,206,13,1.86,13,1,7,NA
13,"B. Swan","Investigation of deep brain stimulation mechanisms during implantable pulse generator replacement surgery",2014,"Neuromodulation",NA,"https://www.scopus.com/inward/record.uri?partnerID=HzOxMe3b&scp=84905161168&origin=inward","https://www.scopus.com/inward/citedby.uri?partnerID=HzOxMe3b&scp=84905161168&origin=inward",125,"2021-03-18 10:43:54","Article","10.1111/ner.12123","1094-7159","https://api.elsevier.com/content/abstract/scopus_id/84905161168",17,5,419,424,13,1.86,13,1,7,NA
13,"R.W. Motl","Continued validation of the Symptom Inventory in multiple sclerosis",2009,"Journal of the Neurological Sciences",NA,"https://www.scopus.com/inward/record.uri?partnerID=HzOxMe3b&scp=69549086362&origin=inward","https://www.scopus.com/inward/citedby.uri?partnerID=HzOxMe3b&scp=69549086362&origin=inward",126,"2021-03-18 10:43:54","Article","10.1016/j.jns.2009.06.015","0022-510X","https://api.elsevier.com/content/abstract/scopus_id/69549086362",285,1,134,136,13,1.08,13,1,12,NA
12,"R. Mehanna","Comparing two deep brain stimulation leads to one in refractory tremor",2014,"Cerebellum",NA,"https://www.scopus.com/inward/record.uri?partnerID=HzOxMe3b&scp=84904640226&origin=inward","https://www.scopus.com/inward/citedby.uri?partnerID=HzOxMe3b&scp=84904640226&origin=inward",127,"2021-03-18 10:43:54","Article","10.1007/s12311-014-0552-9","1473-4222","https://api.elsevier.com/content/abstract/scopus_id/84904640226",13,4,425,432,12,1.71,12,1,7,NA
12,"G. Lindberg","High-resolution manometry changes our views of gastrointestinal motility",2013,"Neurogastroenterology and Motility",NA,"https://www.scopus.com/inward/record.uri?partnerID=HzOxMe3b&scp=84884724694&origin=inward","https://www.scopus.com/inward/citedby.uri?partnerID=HzOxMe3b&scp=84884724694&origin=inward",128,"2021-03-18 10:43:54","Article","10.1111/nmo.12225","1350-1925","https://api.elsevier.com/content/abstract/scopus_id/84884724694",25,10,780,782,12,1.5,12,1,8,NA
12,"F. Yu","A wireless body measurement system to study fatigue in multiple sclerosis",2012,"Physiological Measurement",NA,"https://www.scopus.com/inward/record.uri?partnerID=HzOxMe3b&scp=84869186970&origin=inward","https://www.scopus.com/inward/citedby.uri?partnerID=HzOxMe3b&scp=84869186970&origin=inward",129,"2021-03-18 10:43:54","Article","10.1088/0967-3334/33/12/2033","0967-3334","https://api.elsevier.com/content/abstract/scopus_id/84869186970",33,12,2033,2048,12,1.33,12,1,9,NA
12,"P.F. Grčić","Responsiveness of walking-based outcome measures after multiple sclerosis relapses following steroid pulses",2011,"Medical Science Monitor",NA,"https://www.scopus.com/inward/record.uri?partnerID=HzOxMe3b&scp=82755168740&origin=inward","https://www.scopus.com/inward/citedby.uri?partnerID=HzOxMe3b&scp=82755168740&origin=inward",130,"2021-03-18 10:43:54","Article","10.12659/msm.882130","1234-1010","https://api.elsevier.com/content/abstract/scopus_id/82755168740",17,12,NA,NA,12,1.2,12,1,10,NA
12,"R. Motl","Does the relationship between physical activity and quality of life differ based on generic versus disease-targeted instruments?",2008,"Annals of Behavioral Medicine",NA,"https://www.scopus.com/inward/record.uri?partnerID=HzOxMe3b&scp=53849096673&origin=inward","https://www.scopus.com/inward/citedby.uri?partnerID=HzOxMe3b&scp=53849096673&origin=inward",131,"2021-03-18 10:43:54","Article","10.1007/s12160-008-9049-4","0883-6612","https://api.elsevier.com/content/abstract/scopus_id/53849096673",36,1,93,99,12,0.92,12,1,13,NA
11,"Y. Baram","Gait improvement in patients with cerebral palsy by visual and auditory feedback",2009,"2009 Virtual Rehabilitation International Conference, VR 2009",NA,"https://www.scopus.com/inward/record.uri?partnerID=HzOxMe3b&scp=70449084565&origin=inward","https://www.scopus.com/inward/citedby.uri?partnerID=HzOxMe3b&scp=70449084565&origin=inward",132,"2021-03-18 10:43:54","Conference Paper","10.1109/ICVR.2009.5174222","","https://api.elsevier.com/content/abstract/scopus_id/70449084565",NA,NA,146,149,11,0.92,11,1,12,NA
8,"M.V. Villarejo","Technological solution for determining gait parametersusing pressure sensors: A case study of multiple sclerosis patients",2014,"Bio-Medical Materials and Engineering",NA,"https://www.scopus.com/inward/record.uri?partnerID=HzOxMe3b&scp=84907264712&origin=inward","https://www.scopus.com/inward/citedby.uri?partnerID=HzOxMe3b&scp=84907264712&origin=inward",133,"2021-03-18 10:43:54","Conference Paper","10.3233/BME-141177","0959-2989","https://api.elsevier.com/content/abstract/scopus_id/84907264712",24,6,3511,3522,8,1.14,8,1,7,NA
8,"K. Ickmans","Recovery of peripheral muscle function from fatiguing exercise and daily physical activity level in patients with multiple sclerosis: A case-control study",2014,"Clinical Neurology and Neurosurgery",NA,"https://www.scopus.com/inward/record.uri?partnerID=HzOxMe3b&scp=84901044687&origin=inward","https://www.scopus.com/inward/citedby.uri?partnerID=HzOxMe3b&scp=84901044687&origin=inward",134,"2021-03-18 10:43:54","Article","10.1016/j.clineuro.2014.04.021","0303-8467","https://api.elsevier.com/content/abstract/scopus_id/84901044687",122,NA,97,105,8,1.14,8,1,7,NA
8,"Z. Krištofiková","Neuroinflammation and complexes of 17β-hydroxysteroid dehydrogenase type 10 - amyloid β in alzheimeŕs disease",2013,"Current Alzheimer Research",NA,"https://www.scopus.com/inward/record.uri?partnerID=HzOxMe3b&scp=84874953574&origin=inward","https://www.scopus.com/inward/citedby.uri?partnerID=HzOxMe3b&scp=84874953574&origin=inward",135,"2021-03-18 10:43:54","Article","10.2174/1567205011310020006","1567-2050","https://api.elsevier.com/content/abstract/scopus_id/84874953574",10,2,165,173,8,1,8,1,8,NA
7,"J. Sosnoff","Does a waist-worn ActiGraph accelerometer quantify community ambulation in persons with multiple sclerosis?",2012,"Journal of Rehabilitation Research and Development",NA,"https://www.scopus.com/inward/record.uri?partnerID=HzOxMe3b&scp=84872701264&origin=inward","https://www.scopus.com/inward/citedby.uri?partnerID=HzOxMe3b&scp=84872701264&origin=inward",136,"2021-03-18 10:43:54","Article","10.1682/JRRD.2011.11.0218","0748-7711","https://api.elsevier.com/content/abstract/scopus_id/84872701264",49,9,1405,1410,7,0.78,7,1,9,NA
7,"S. Schlesinger","Is it possible to measure mobility deficits of patients suffering from multiple sclerosis?: Evaluation of mobility of patients with MS and motor dysfunctions by means of accelerometers",2011,"Klinische Neurophysiologie",NA,"https://www.scopus.com/inward/record.uri?partnerID=HzOxMe3b&scp=79952683316&origin=inward","https://www.scopus.com/inward/citedby.uri?partnerID=HzOxMe3b&scp=79952683316&origin=inward",137,"2021-03-18 10:43:54","Article","10.1055/s-0031-1271750","1434-0275","https://api.elsevier.com/content/abstract/scopus_id/79952683316",42,1,17,21,7,0.7,7,1,10,NA
7,"Y. Baram","Glide-symmetric locomotion reinforcement in patients with multiple sclerosis by visual feedback",2010,"Disability and Rehabilitation: Assistive Technology",NA,"https://www.scopus.com/inward/record.uri?partnerID=HzOxMe3b&scp=77954846108&origin=inward","https://www.scopus.com/inward/citedby.uri?partnerID=HzOxMe3b&scp=77954846108&origin=inward",138,"2021-03-18 10:43:54","Article","10.3109/17483101003671717","1748-3107","https://api.elsevier.com/content/abstract/scopus_id/77954846108",5,5,323,326,7,0.64,7,1,11,NA
7,"A.R. Potvin","Validity of quantitative tests measuring tremor",1975,"American Journal of Physical Medicine",NA,"https://www.scopus.com/inward/record.uri?partnerID=HzOxMe3b&scp=0016567423&origin=inward","https://www.scopus.com/inward/citedby.uri?partnerID=HzOxMe3b&scp=0016567423&origin=inward",139,"2021-03-18 10:43:54","Article","","0002-9491","https://api.elsevier.com/content/abstract/scopus_id/0016567423",54,5,243,252,7,0.15,7,1,46,NA
6,"X. Li","Thermoelectric cooling device integrated with PCM heat storage for ms patients",2014,"Energy Procedia",NA,"https://www.scopus.com/inward/record.uri?partnerID=HzOxMe3b&scp=84922384890&origin=inward","https://www.scopus.com/inward/citedby.uri?partnerID=HzOxMe3b&scp=84922384890&origin=inward",140,"2021-03-18 10:43:54","Conference Paper","10.1016/j.egypro.2014.12.014","1876-6102","https://api.elsevier.com/content/abstract/scopus_id/84922384890",61,NA,2399,2402,6,0.86,6,1,7,NA
5,"C. Schwartz","Investigating the minimal important difference in ambulation in multiple sclerosis: A disconnect between performance-based and patient-reported outcomes?",2014,"Journal of the Neurological Sciences",NA,"https://www.scopus.com/inward/record.uri?partnerID=HzOxMe3b&scp=84920143068&origin=inward","https://www.scopus.com/inward/citedby.uri?partnerID=HzOxMe3b&scp=84920143068&origin=inward",141,"2021-03-18 10:43:54","Article","10.1016/j.jns.2014.10.021","0022-510X","https://api.elsevier.com/content/abstract/scopus_id/84920143068",347,1,268,274,5,0.71,5,1,7,NA
5,"P. Filipović Grčić","Correlation analysis of visual analogue scale and measures of walking ability in multiple sclerosis patients",2013,"Acta Neurologica Belgica",NA,"https://www.scopus.com/inward/record.uri?partnerID=HzOxMe3b&scp=84891641774&origin=inward","https://www.scopus.com/inward/citedby.uri?partnerID=HzOxMe3b&scp=84891641774&origin=inward",142,"2021-03-18 10:43:54","Article","10.1007/s13760-013-0187-5","0300-9009","https://api.elsevier.com/content/abstract/scopus_id/84891641774",113,4,397,402,5,0.63,5,1,8,NA
5,"B.M. Sandroff","Accelerometer measured physical activity and the integrity of the anterior visual pathway in multiple sclerosis",2014,"Multiple Sclerosis and Related Disorders",NA,"https://www.scopus.com/inward/record.uri?partnerID=HzOxMe3b&scp=84884291544&origin=inward","https://www.scopus.com/inward/citedby.uri?partnerID=HzOxMe3b&scp=84884291544&origin=inward",143,"2021-03-18 10:43:54","Article","10.1016/j.msard.2013.06.014","2211-0348","https://api.elsevier.com/content/abstract/scopus_id/84884291544",3,1,117,122,5,0.71,5,1,7,NA
4,"S. Morrison","The dynamics of finger tremor in multiple sclerosis is affected by whole body position",2013,"Journal of the Neurological Sciences",NA,"https://www.scopus.com/inward/record.uri?partnerID=HzOxMe3b&scp=84870884241&origin=inward","https://www.scopus.com/inward/citedby.uri?partnerID=HzOxMe3b&scp=84870884241&origin=inward",144,"2021-03-18 10:43:54","Article","10.1016/j.jns.2012.10.007","0022-510X","https://api.elsevier.com/content/abstract/scopus_id/84870884241",324,1,84,89,4,0.5,4,1,8,NA
4,"A. Rashid","Usage of accelerometers in home care for multiple sclerosis patients",2007,"European Conference on eHealth 2007, Proceedings of the ECEH 2007",NA,"https://www.scopus.com/inward/record.uri?partnerID=HzOxMe3b&scp=80054887921&origin=inward","https://www.scopus.com/inward/citedby.uri?partnerID=HzOxMe3b&scp=80054887921&origin=inward",145,"2021-03-18 10:43:54","Conference Paper","","","https://api.elsevier.com/content/abstract/scopus_id/80054887921",NA,NA,177,191,4,0.29,4,1,14,NA
4,"P. Brown","A new clinical technique for demonstrating changes in eye acceleration during horizontal saccades in patients with partial internuclear ophthalmoplegias",1998,"Journal of Neuro-Ophthalmology",NA,"https://www.scopus.com/inward/record.uri?partnerID=HzOxMe3b&scp=0031881429&origin=inward","https://www.scopus.com/inward/citedby.uri?partnerID=HzOxMe3b&scp=0031881429&origin=inward",146,"2021-03-18 10:43:54","Article","10.1097/00041327-199803000-00009","1070-8022","https://api.elsevier.com/content/abstract/scopus_id/0031881429",18,1,36,39,4,0.17,4,1,23,NA
3,"M. Vandermaesen","ReHoblet - A home-based rehabilitation game on the tablet",2014,"2014 IEEE 16th International Conference on e-Health Networking, Applications and Services, Healthcom 2014",NA,"https://www.scopus.com/inward/record.uri?partnerID=HzOxMe3b&scp=84921732967&origin=inward","https://www.scopus.com/inward/citedby.uri?partnerID=HzOxMe3b&scp=84921732967&origin=inward",147,"2021-03-18 10:43:54","Conference Paper","10.1109/HealthCom.2014.7001878","","https://api.elsevier.com/content/abstract/scopus_id/84921732967",NA,NA,411,416,3,0.43,3,1,7,NA
