,Author.Names,Title,Source.title,Publication.Year,Abstract,Publication.Type,DOI,ID,database,yvonne_included,yvonne_excluded,yvonne_comments,catherine_included,catherine_excluded,catherine_comment,tim,tim_comment
685,"Chiauzzi, E; Hekler, EB; Lee, J; Towner, A; DasMahapatra, P; Fitz-Randolph, M",In search of a daily physical activity sweet spot: Piloting a digital tracking intervention for people with multiple sclerosis,DIGITAL HEALTH,2019,"Objective This pilot study tested a course-based intervention to help people with multiple sclerosis (MS) match their daily activity to symptom severity (sweet spot) using wearable activity trackers. Methods This two-phase study recruited online research network members reporting MS and who were utilizing Fitbit One (TM) activity trackers. In the first phase, participant interviews assessed demand based on physical activity and the use of behavior-change techniques. The second phase assessed the demand, limited efficacy, acceptability, and practicality of a Wearables 101 course that integrated behavior change and self-experimentation principles. Tracker data were used to determine the percent of matches between daily symptom-based step goals and step counts. Results Participants expressed demand in the form of interest in gaining insights about a possible sweet spot behavioral target, if a system could be produced to support that. Limited efficacy results were mixed, with approximately one-third of participants dropping out and only half matching their daily target goals for at least 50% of days. In terms of practicality, participants commented on the burden of daily measurement and the need for a longer baseline period. Participants noted that tracking helped support an understanding of the link between activities and symptom severity, suggesting acceptability. Conclusions Results suggested that the intervention demand and acceptability criteria were demonstrated more strongly than limited efficacy and practicality. The matching intervention tested in this study will require refinement in baseline measurement, goal definition, and reduced data-gathering burden. Such changes may improve efficacy and practicality requirements and, by extension, later impact of the intervention on MS outcomes. Overall, these results provide justification for additional work on refining the intervention to increase practicality and efficacy.",Article,10.1177/2055207619872077,WOS:000483763900001,WoS,Yes,,Fitbit,no,Out of scope,Read for discussion,Out of scope (outcomes),Fitbit
686,"Anastasi D., Carpinella I., Gervasoni E., Matsuda P.N., Bovi G., Ferrarin M., Cattaneo D.",Instrumented Version of the Modified Dynamic Gait Index in Patients With Neurologic Disorders,PM and R,2019,"Background: Gait instability is common in adults with neurologic disorders and the modified Dynamic Gait Index (mDGI) was recently introduced to assess dynamic balance. However, instrumental assessment is needed to provide quantitative measures. Objective: To develop and validate an instrumented version of the mDGI. Design: Cross-sectional study. Setting: Clinical setting. Participants: Thirty adults with neurologic disorders (10 with multiple sclerosis, 10 with Parkinson disease, and 10 with stroke) and 20 healthy volunteers. Methods: Participants were assessed with the Timed Up and Go test (TUG) and with the mDGI. During the assessment of mDGI, data were collected by a single Inertial Measurement Unit (IMU) positioned on the sternum. Principal component analysis (PCA) was performed on the instrumented data extracting eight PC scores (ImPC) describing dynamic balance. The instrumented overall score (ImDGI) was then calculated as the sum of the mPCs. PCA revealed two components associated with stride features and regularity (ImDGI_Gait_Pattern) and trunk movements (ImDGI_Trunk_Sway). Spearman coefficients were calculated between mDGI and ImDGI, whereas Mann-Whitney (U) and Kruskal-Wallis (H) tests assessed differences between groups and neurologic conditions. Main Outcome Measurements: ImDGI. Results: ImDGI did not show ceiling effects, and good correlations were found between ImDGI and mDGI (r =.84), and TUG (r =.84) for people with neurologic disorders (P <.001). Significant differences among pathologies (H test((2))=12.5, P =.002) and between healthy participants and adults with neurologic disorders (U test = 47.0, P =.001) were found. ImDGI_Trunk_Sway discriminated between people using or not using walking aids and among the three pathologies (H((2)) = 10.0, P =.007). Conclusions: The ImDGI test seems to provide valid measures to objectively assess dynamic balance in neurologic conditions and possibly quantify balance deficits also in adults with neurologic disorders.",Article,10.1002/PMRJ.12137,http://sfx.metabib.ch/sfx_locater?sid=EMBASE&issn=19341482&id=doi:10.1002%2Fpmrj.12137&atitle=Instrumented+Version+of+the+Modified+Dynamic+Gait+Index+in+Patients+With+Neurologic+Disorders&stitle=PM+R&title=PM+and+R&volume=11&issue=12&spage=1312&epage=1319&aulast=Anastasi&aufirst=Denise&auinit=D.&aufull=Anastasi+D.&coden=&isbn=&pages=1312-1319&date=2019&auinit1=D&auinitm=,Embase,Yes,,,no,Out of scope,,included,
696,"Manresa-Yee, C; Roig-Maimo, MF; Varona, J",Mobile accessibility: natural user interface for motion-impaired users,UNIVERSAL ACCESS IN THE INFORMATION SOCIETY,2019,"We designed a natural user interface to access mobile devices for motion-impaired people who cannot use the standard multi-touch input system to work with tablets and smartphones. We detect the head motion of the user by means of the frontal camera and use its position to interact with the mobile device. The purpose of this work is to evaluate the performance of the system. We conducted two laboratory studies with 12 participants without disabilities and a field study with four participants with multiple sclerosis (MS). The first laboratory study was done to test the robustness and to count with a base to compare the results of the evaluation done with the participants with MS. Once observed the results of the participants with disabilities, we conducted a new laboratory study with participants without disabilities simulating the limitations of the users with MS to tune the system. All participants completed a set of defined tasks: pointing and pointing-selecting. We logged use and conducted questionnaires post-experiment. Our results showed positive outcomes using the system as an input device, although apps should follow a set of recommendations on the size of the targets and their position to facilitate the interaction with mobile devices for motion-impaired users. The work demonstrates the interface's possibilities for mobile accessibility for motion-impaired users who need alternative access devices to interact with mobile devices.",Article,10.1007/S10209-017-0583-3,WOS:000461373700006,WoS,Yes,,,no,Out of scope,,Out of scope (topic),Head tracking smartphone interface (?)
697,"Babbage D.R., van Kessel K., Drown J., Thomas S., Sezier A., Thomas P., Kersten P.",MS Energize: Field trial of an app for self-management of fatigue for people with multiple sclerosis,Internet Interventions,2019,"Multiple sclerosis (MS) is a lifelong neurological condition affecting around 2.2 million people worldwide. There are a wide range of symptoms, with fatigue reported as one of the most troublesome. MS Energizeor MS Energise in UK English regionsis an iPhone app focused on self-management of fatigue for people with MS. Based on cognitive-behavioral therapy principles, the app covers MS fatigue, how to use energy effectively, how behavior, thoughts and emotions interact and impact on MS fatigue, as well as the potential effects of bodily and environmental factors. MS Energize provides education, interactive tasks, and supports application of the principles into a user's day-to-day life. We field tested the usability and perceived usefulness of MS Energize with 11 people with longstanding multiple sclerosis in New Zealand and the United Kingdom. Participants used the app over a period of five to six weeks after which they rated the usability of the app and participated in an in-depth qualitative interview. We developed four main themes through our thematic analysis. 1. Validation of participants' own experiences of living with MS fatigue. 2. The personal cost in engaging with such an intervention. 3. Reframing experiences and adding to knowledge. 4. That the app was generally a good idea. Field testers' feedback also identified usability issues that could be addressed. In particular, the amount of text-based content in the app contributed to the app itself being fatiguing. This field-testing process has highlighted the value of the app while also guiding our roadmap for further developments to enhance usability and usefulness. The next step is further refinement of components of MS Energize in preparation for a trial of its clinical and cost effectiveness.",Article,10.1016/J.INVENT.2019.100291,http://sfx.metabib.ch/sfx_locater?sid=EMBASE&issn=22147829&id=doi:10.1016%2Fj.invent.2019.100291&atitle=MS+Energize%3A+Field+trial+of+an+app+for+self-management+of+fatigue+for+people+with+multiple+sclerosis&stitle=Internet+Interv.&title=Internet+Interventions&volume=18&issue=&spage=&epage=&aulast=Babbage&aufirst=Duncan+R.&auinit=D.R.&aufull=Babbage+D.R.&coden=&isbn=&pages=-&date=2019&auinit1=D&auinitm=R,Embase,No,Out of scope (topic),,yes,,,Out of scope (topic),
713,"Barker J., Smith Byrne K., Doherty A., Foster C., Rahimi K., Ramakrishnan R., Woodward M., Dwyer T.",Physical activity of UK adults with chronic disease: Cross-sectional analysis of accelerometer-measured physical activity in 96 706 UK Biobank participants,International Journal of Epidemiology,2019,"Background: Physical inactivity is associated with an increased risk of major chronic diseases, although uncertainty exists about which chronic diseases, themselves, might contribute to physical inactivity. The objective of this study was to compare the physical activity of those with chronic diseases to healthy individuals using an objective measure of physical activity. Methods: We conducted a cross-sectional analysis of data from 96 706 participants aged 40 years or older from the UK Biobank prospective cohort study (2006-10). Diagnoses were identified through ICD 9 and 10 coding within hospital admission records and a cancer registry linked to UK Biobank participants. We extracted summary physical activity information from participants who wore a wrist-worn triaxial accelerometer for 7 days. Statistical analyses included computation of adjusted geometric means and means using general linear models. Results: Participants with chronic disease undertook 9% or 61 minutes (95% confidence interval: 57.8-64.8) less moderate activity and 11% or 3 minutes (95% confidence interval: 2.7-3.3) less vigorous activity per week than individuals without chronic disease. Participants in every chronic-disease subgroup undertook less physical activity than those without chronic disease. Sixty-seven diagnoses within these subgroups were associated with lower moderate activity. Conclusions: The cross-sectional association of physical activity with chronic disease is broad. Given the substantial health benefits of being physically active, clinicians and policymakers should be aware that their patients with any chronic disease are at greater health risk from other diseases than anticipated because of their physical inactivity.",Article,10.1093/IJE/DYY294,http://sfx.metabib.ch/sfx_locater?sid=EMBASE&issn=14643685&id=doi:10.1093%2Fije%2Fdyy294&atitle=Physical+activity+of+UK+adults+with+chronic+disease%3A+Cross-sectional+analysis+of+accelerometer-measured+physical+activity+in+96+706+UK+Biobank+participants&stitle=Int.+J.+Epidemiol.&title=International+Journal+of+Epidemiology&volume=48&issue=4&spage=1167&epage=1174&aulast=Barker&aufirst=Joseph&auinit=J.&aufull=Barker+J.&coden=IJEPB&isbn=&pages=1167-1174&date=2019&auinit1=J&auinitm=,Embase,No,Out of scope (topic),,yes,Out of scope,,Out of scope (topic),no MS patients
722,"Chitnis T., Glanz B.I., Gonzalez C., Healy B.C., Saraceno T.J., Sattarnezhad N., Diaz-Cruz C., Polgar-Turcsanyi M., Tummala S., Bakshi R., Bajaj V.S., Ben-Shimol D., Bikhchandani N., Blocker A.W., Burkart J., Cendrillon R., Cusack M.P., Demiralp E., Jooste S.K., Kharbouch A., Lee A.A., Lehár J., Liu M., Mahadevan S., Murphy M., Norton L.C., Parlikar T.A., Pathak A., Shoeb A., Soderberg E., Stephens P., Stoertz A.H., Thng F., Tumkur K., Wang H., Rhodes J., Rudick R.A., Ransohoff R.M., Phillips G.A., Bruzik E., Marks W.J., Weiner H.L., Snyder T.M.",Quantifying neurologic disease using biosensor measurements in-clinic and in free-living settings in multiple sclerosis,npj Digital Medicine,2019,"Technological advances in passive digital phenotyping present the opportunity to quantify neurological diseases using new approaches that may complement clinical assessments. Here, we studied multiple sclerosis (MS) as a model neurological disease for investigating physiometric and environmental signals. The objective of this study was to assess the feasibility and correlation of wearable biosensors with traditional clinical measures of disability both in clinic and in free-living in MS patients. This is a single site observational cohort study conducted at an academic neurological center specializing in MS. A cohort of 25 MS patients with varying disability scores were recruited. Patients were monitored in clinic while wearing biosensors at nine body locations at three separate visits. Biosensor-derived features including aspects of gait (stance time, turn angle, mean turn velocity) and balance were collected, along with standardized disability scores assessed by a neurologist. Participants also wore up to three sensors on the wrist, ankle, and sternum for 8 weeks as they went about their daily lives. The primary outcomes were feasibility, adherence, as well as correlation of biosensor-derived metrics with traditional neurologist-assessed clinical measures of disability. We used machine-learning algorithms to extract multiple features of motion and dexterity and correlated these measures with more traditional measures of neurological disability, including the expanded disability status scale (EDSS) and the MS functional composite-4 (MSFC-4). In free-living, sleep measures were additionally collected. Twenty-three subjects completed the first two of three in-clinic study visits and the 8-week free-living biosensor period. Several biosensor-derived features significantly correlated with EDSS and MSFC-4 scores derived at visit two, including mobility stance time with MSFC-4 z-score (Spearman correlation ?0.546; p = 0.0070), several aspects of turning including turn angle (0.437; p = 0.0372), and maximum angular velocity (0.653; p = 0.0007). Similar correlations were observed at subsequent clinic visits, and in the free-living setting. We also found other passively collected signals, including measures of sleep, that correlated with disease severity. These findings demonstrate the feasibility of applying passive biosensor measurement techniques to monitor disability in MS patients both in clinic and in the free-living setting.",Article,10.1038/S41746-019-0197-7,http://sfx.metabib.ch/sfx_locater?sid=EMBASE&issn=23986352&id=doi:10.1038%2Fs41746-019-0197-7&atitle=Quantifying+neurologic+disease+using+biosensor+measurements+in-clinic+and+in+free-living+settings+in+multiple+sclerosis&stitle=npj+Digit.+Med.&title=npj+Digital+Medicine&volume=2&issue=1&spage=&epage=&aulast=Chitnis&aufirst=Tanuja&auinit=T.&aufull=Chitnis+T.&coden=&isbn=&pages=-&date=2019&auinit1=T&auinitm=,Embase,Yes,,,no,Out of scope,Biosensors,included,
730,R.E. Bollaert,Self-efficacy and physical and cognitive function in older adults with multiple sclerosis,International Journal of MS Care,2019,NA,Article,10.7224/1537-2073.2018-001,https://www.scopus.com/inward/record.uri?partnerID=HzOxMe3b&scp=85073699578&origin=inward,Scopus,No,Out of scope (topic),,yes,,,included,accelerometer used as outcome measure
735,"Motl R.W., Sasaki J.E., Cederberg K.L., Jeng B.",Social-cognitive theory variables as correlates of sedentary behavior in multiple sclerosis: Preliminary evidence,Disability and Health Journal,2019,"Background: Persons with multiple sclerosis(MS) engage in substantially more sedentary behavior than adults from the general population. Objective: Hypothesis: This preliminary, cross-sectional study examined social-cognitive theory(SCT) variables as correlates of sedentary behavior in MS. We hypothesized that scores from SCT variables for sedentary behavior change would correlate with scores from self-reported and device-measured volumes of sedentary behavior in MS. We further hypothesized that the correlations would be stronger for self-reported than device-measured sedentary behavior, and that the primary correlate of sedentary behavior would be self-efficacy. Methods: We recruited participants through a random sample of 1,000 persons enrolled in the North American Research Committee on MS registry, and 275 of the 296 persons who underwent screening volunteered for the study. Participants wore an ActiGraph accelerometer on a belt around the waist for measuring minutes per day of sedentary behavior. Participants further completed a newly-created, study-specific measure of SCT variables for reducing sedentary behavior(i.e., self-efficacy, outcome expectations, barriers, goal setting, & planning) and the abbreviated International Physical Activity Questionnaire as a self-report measure of sitting time. Results: Self-reported sedentary behavior was associated with self-efficacy(r = ?0.47), goal setting(r = ?0.31), planning(r = ?0.35), and barriers(r = 0.39) for reducing sedentary behavior. Device-measured sedentary behavior was associated with self-efficacy(r = ?0.32), goal setting(r = ?0.21), planning(r = ?0.18), and barriers(r = 0.20). Self-efficacy(? = ?0.29), barriers(? = 0.26), and planning(? = ?0.24) independently explained variance in self-reported sedentary behavior(R(2) = 0.33). Only self-efficacy(? = ?0.32) independently explained variance in device-measured sedentary behavior(R(2) = 0.10). Conclusion: SCT constructs might be reasonable targets of a behavioral intervention for reducing sedentary behavior in MS.",Article,10.1016/J.DHJO.2019.05.002,http://sfx.metabib.ch/sfx_locater?sid=EMBASE&issn=18767583&id=doi:10.1016%2Fj.dhjo.2019.05.002&atitle=Social-cognitive+theory+variables+as+correlates+of+sedentary+behavior+in+multiple+sclerosis%3A+Preliminary+evidence&stitle=Disabil.+Health+J.&title=Disability+and+Health+Journal&volume=12&issue=4&spage=622&epage=627&aulast=Motl&aufirst=Robert+W.&auinit=R.W.&aufull=Motl+R.W.&coden=&isbn=&pages=622-627&date=2019&auinit1=R&auinitm=W,Embase,No,Out of scope (topic),,yes,,,included,accelerometer used as outcome measure
739,"Turner, A; Hayes, S",The Classification of Minor Gait Alterations Using Wearable Sensors and Deep Learning,IEEE TRANSACTIONS ON BIOMEDICAL ENGINEERING,2019,"Objective: This paper describes how non-invasive wearable sensors can be used in combination with deep learning to classify artificially induced gait alterations without the requirement for a medical professional or gait analyst to be present. This approach is motivated by the goal of diagnosing gait abnormalities on a symptom-by-symptom basis, irrespective of other neuromuscular movement disorders the patients may be affected by. This could lead to improvements in treatment and offer a greater insight into movement disorders. Methods: In-shoe pressure was measured for 12 able-bodied participants, each subject to eight artificially induced gait alterations, achieved by modifying the underside of the shoe. The data were recorded at 100 Hz over 2520 data channels and were analyzed using the deep learning architecture and the long term short term memory networks. Additionally, the rationale for the decision-making process of these networks was investigated. Conclusion: Long term short term memory networks are applicable to the classification of the gait function. The classifications can be made using only 2 s of sparse data (82.0% accuracy over 96 000 instances of test data) from participants who were not a part of the training set. Significance: This paper provides potential for the gait function to be accurately classified using non-invasive techniques, and at more regular intervals, outside of a clinical setting, without the need for healthcare professionals to be present.",Article,10.1109/TBME.2019.2900863,WOS:000502102200015,WoS,No,Out of scope (topic),,yes,,,Out of scope (topic),"no MS patients, interesting (pressure in-shoe in HC only)"
746,"Braakhuis H.E.M., Berger M.A.M., Van Der Stok G.A., Van Meeteren J., De Groot V., Beckerman H., Bussmann J.B.J., Malekzadeh A., Van Den Akker L.E., Looijmans M., Sanches S.A., Dekker J., Collette E.H., Van Oosten B.W., Teunissen C.E., Blankenstein M.A., Eijssen I.C.J.M., Rietberg M., Heine M., Verschuren O., Kwakkel G., Visser-Meily J.M.A., Van De Port I.G.L., Lindeman E., Blikman L.J.M., Van Meeteren J., Bussmann J.B.J., Stam H.J., Hintzen R.Q., Hacking H.G.A., Hoogervorst E.L., Frequin S.T.F.M., Knoop H., De Jong B.A., Bleijenberg G., De Laat F.A.J., Verhulsdonck M.C., Van Munster E.T.L., Oosterwijk C.J., Aarts G.J.",Three distinct physical behavior types in fatigued patients with multiple sclerosis,Journal of NeuroEngineering and Rehabilitation,2019,"Background: Multiple sclerosis often leads to fatigue and changes in physical behavior (PB). Changes in PB are often assumed as a consequence of fatigue, but effects of interventions that aim to reduce fatigue by improving PB are not sufficient. Since the heterogeneous nature of MS related symptoms, levels of PB of fatigued patients at the start of interventions might vary substantially. Better understanding of the variability by identification of PB subtypes in fatigued patients may help to develop more effective personalized rehabilitation programs in the future. This study aimed to identify PB subtypes in fatigued patients with multiple sclerosis based on multidimensional PB outcome measures. Methods: Baseline accelerometer (Actigraph) data, demographics and clinical characteristics of the TREFAMS-ACE participants (n = 212) were used for secondary analysis. All patients were ambulatory and diagnosed with severe fatigue based on a score of ?35 on the fatigue subscale of the Checklist Individual Strength (CIS20r). Fifteen PB measures were used derived from 7 day measurements with an accelerometer. Principal component analysis was performed to define key outcome measures for PB and two-step cluster analysis was used to identify PB types. Results: Analysis revealed five key outcome measures: percentage sedentary behavior, total time in prolonged moderate-to-vigorous physical activity, number of sedentary bouts, and two types of change scores between day parts (morning, afternoon and evening). Based on these outcomes three valid PB clusters were derived. Conclusions: Patients with severe MS-related fatigue show three distinct and homogeneous PB subtypes. These PB subtypes, based on a unique set of PB outcome measures, may offer an opportunity to design more individually-tailored interventions in rehabilitation. Trial registration: Clinical trial registration no ISRCTN 82353628, ISRCTN 69520623 and ISRCTN 58583714.",Article,10.1186/S12984-019-0573-1,http://sfx.metabib.ch/sfx_locater?sid=EMBASE&issn=17430003&id=doi:10.1186%2Fs12984-019-0573-1&atitle=Three+distinct+physical+behavior+types+in+fatigued+patients+with+multiple+sclerosis&stitle=J.+NeuroEng.+Rehabil.&title=Journal+of+NeuroEngineering+and+Rehabilitation&volume=16&issue=1&spage=&epage=&aulast=Braakhuis&aufirst=&auinit=H.E.M.&aufull=Braakhuis+H.E.M.&coden=&isbn=&pages=-&date=2019&auinit1=H&auinitm=E.M.,Embase,No,Out of scope (topic),,yes,,,included,accelerometer used as outcome measure
