"Cites","Authors","Title","Year","Source","Publisher","ArticleURL","CitesURL","GSRank","QueryDate","Type","DOI","ISSN","CitationURL","Volume","Issue","StartPage","EndPage","ECC","CitesPerYear","CitesPerAuthor","AuthorCount","Age","Abstract"
10,"P. Luzio de Melo","A Microcontroller Platform for the Rapid Prototyping of Functional Electrical Stimulation-Based Gait Neuroprostheses",2015,"Artificial Organs",NA,"https://www.scopus.com/inward/record.uri?partnerID=HzOxMe3b&scp=84929031144&origin=inward","https://www.scopus.com/inward/citedby.uri?partnerID=HzOxMe3b&scp=84929031144&origin=inward",71,"2021-03-18 10:42:38","Article","10.1111/aor.12400","0160-564X","https://api.elsevier.com/content/abstract/scopus_id/84929031144",39,5,NA,NA,10,1.67,10,1,6,NA
9,"R.W. Motl","Phase-III, randomized controlled trial of the behavioral intervention for increasing physical activity in multiple sclerosis: Project BIPAMS",2018,"Contemporary Clinical Trials",NA,"https://www.scopus.com/inward/record.uri?partnerID=HzOxMe3b&scp=85049337005&origin=inward","https://www.scopus.com/inward/citedby.uri?partnerID=HzOxMe3b&scp=85049337005&origin=inward",72,"2021-03-18 10:42:38","Article","10.1016/j.cct.2018.06.017","1551-7144","https://api.elsevier.com/content/abstract/scopus_id/85049337005",71,NA,154,161,9,3,9,1,3,NA
9,"C.M. Abreu","Emerging biosensing technologies for neuroinflammatory and neurodegenerative disease diagnostics",2018,"Frontiers in Molecular Neuroscience",NA,"https://www.scopus.com/inward/record.uri?partnerID=HzOxMe3b&scp=85048961309&origin=inward","https://www.scopus.com/inward/citedby.uri?partnerID=HzOxMe3b&scp=85048961309&origin=inward",73,"2021-03-18 10:42:38","Short Survey","10.3389/fnmol.2018.00164","1662-5099","https://api.elsevier.com/content/abstract/scopus_id/85048961309",11,NA,NA,NA,9,3,9,1,3,NA
9,"V.M.J. Smith","Movement measurements at home for multiple sclerosis: Walking speed measured by a novel ambient measurement system",2018,"Multiple Sclerosis Journal - Experimental, Translational and Clinical",NA,"https://www.scopus.com/inward/record.uri?partnerID=HzOxMe3b&scp=85042296689&origin=inward","https://www.scopus.com/inward/citedby.uri?partnerID=HzOxMe3b&scp=85042296689&origin=inward",74,"2021-03-18 10:42:38","Article","10.1177/2055217317753465","2055-2173","https://api.elsevier.com/content/abstract/scopus_id/85042296689",4,1,NA,NA,9,3,9,1,3,NA
9,"M. Pau","Texting while walking differently alters gait patterns in people with multiple sclerosis and healthy individuals",2018,"Multiple Sclerosis and Related Disorders",NA,"https://www.scopus.com/inward/record.uri?partnerID=HzOxMe3b&scp=85036526864&origin=inward","https://www.scopus.com/inward/citedby.uri?partnerID=HzOxMe3b&scp=85036526864&origin=inward",75,"2021-03-18 10:42:38","Article","10.1016/j.msard.2017.11.021","2211-0348","https://api.elsevier.com/content/abstract/scopus_id/85036526864",19,NA,129,133,9,3,9,1,3,NA
9,"T. Krüger","Subjective and objective assessment of physical activity in multiple sclerosis and their relation to health-related quality of life",2017,"BMC Neurology",NA,"https://www.scopus.com/inward/record.uri?partnerID=HzOxMe3b&scp=85010379669&origin=inward","https://www.scopus.com/inward/citedby.uri?partnerID=HzOxMe3b&scp=85010379669&origin=inward",76,"2021-03-18 10:42:38","Article","10.1186/s12883-016-0783-0","1471-2377","https://api.elsevier.com/content/abstract/scopus_id/85010379669",17,1,NA,NA,9,2.25,9,1,4,NA
9,"F. Real-Fernández","Label-free method for anti-glucopeptide antibody detection in Multiple Sclerosis",2015,"MethodsX",NA,"https://www.scopus.com/inward/record.uri?partnerID=HzOxMe3b&scp=84925135447&origin=inward","https://www.scopus.com/inward/citedby.uri?partnerID=HzOxMe3b&scp=84925135447&origin=inward",77,"2021-03-18 10:42:38","Article","10.1016/j.mex.2015.03.004","2215-0161","https://api.elsevier.com/content/abstract/scopus_id/84925135447",2,NA,141,144,9,1.5,9,1,6,NA
8,"I. Carpinella","Instrumental Assessment of Stair Ascent in People with Multiple Sclerosis, Stroke, and Parkinson's Disease: A Wearable-Sensor-Based Approach",2018,"IEEE Transactions on Neural Systems and Rehabilitation Engineering",NA,"https://www.scopus.com/inward/record.uri?partnerID=HzOxMe3b&scp=85056574991&origin=inward","https://www.scopus.com/inward/citedby.uri?partnerID=HzOxMe3b&scp=85056574991&origin=inward",78,"2021-03-18 10:42:38","Article","10.1109/TNSRE.2018.2881324","1534-4320","https://api.elsevier.com/content/abstract/scopus_id/85056574991",26,12,2324,2332,8,2.67,8,1,3,NA
8,"J. Gong","Causality Analysis of Inertial Body Sensors for Multiple Sclerosis Diagnostic Enhancement",2016,"IEEE Journal of Biomedical and Health Informatics",NA,"https://www.scopus.com/inward/record.uri?partnerID=HzOxMe3b&scp=84987707859&origin=inward","https://www.scopus.com/inward/citedby.uri?partnerID=HzOxMe3b&scp=84987707859&origin=inward",79,"2021-03-18 10:42:38","Article","10.1109/JBHI.2016.2589902","2168-2194","https://api.elsevier.com/content/abstract/scopus_id/84987707859",20,5,1273,1280,8,1.6,8,1,5,NA
8,"L. Venugopalan","Upper limb functional electrical stimulation devices and their man-machine interfaces",2015,"Journal of Medical Engineering and Technology",NA,"https://www.scopus.com/inward/record.uri?partnerID=HzOxMe3b&scp=84947044971&origin=inward","https://www.scopus.com/inward/citedby.uri?partnerID=HzOxMe3b&scp=84947044971&origin=inward",80,"2021-03-18 10:42:38","Review","10.3109/03091902.2015.1102344","0309-1902","https://api.elsevier.com/content/abstract/scopus_id/84947044971",39,8,471,479,8,1.33,8,1,6,NA
8,"E. Gibbs","Antibody dissociation rates are predictive of neutralizing antibody (NAb) course: A comparison of interferon beta-1b-treated Multiple Sclerosis (MS) patients with transient versus sustained NAbs",2015,"Clinical Immunology",NA,"https://www.scopus.com/inward/record.uri?partnerID=HzOxMe3b&scp=84922553104&origin=inward","https://www.scopus.com/inward/citedby.uri?partnerID=HzOxMe3b&scp=84922553104&origin=inward",81,"2021-03-18 10:42:38","Article","10.1016/j.clim.2014.12.005","1521-6616","https://api.elsevier.com/content/abstract/scopus_id/84922553104",157,1,91,101,8,1.33,8,1,6,NA
7,"R.E. Klaren","Objectively measured sedentary behavior and brain volumetric measurements in multiple sclerosis",2017,"Neurodegenerative disease management",NA,"https://www.scopus.com/inward/record.uri?partnerID=HzOxMe3b&scp=85050580018&origin=inward","https://www.scopus.com/inward/citedby.uri?partnerID=HzOxMe3b&scp=85050580018&origin=inward",82,"2021-03-18 10:42:38","Article","10.2217/nmt-2016-0036","1758-2032","https://api.elsevier.com/content/abstract/scopus_id/85050580018",7,1,31,37,7,1.75,7,1,4,NA
7,"J. Ryan","Changing physical activity behaviour for people with multiple sclerosis: Protocol of a randomised controlled feasibility trial (iStep-MS)",2017,"BMJ Open",NA,"https://www.scopus.com/inward/record.uri?partnerID=HzOxMe3b&scp=85049924366&origin=inward","https://www.scopus.com/inward/citedby.uri?partnerID=HzOxMe3b&scp=85049924366&origin=inward",83,"2021-03-18 10:42:38","Article","10.1136/bmjopen-2017-018875","2044-6055","https://api.elsevier.com/content/abstract/scopus_id/85049924366",7,11,NA,NA,7,1.75,7,1,4,NA
7,"T. Wahls","Dietary approaches to treat MS-related fatigue: Comparing the modified Paleolithic (Wahls Elimination) and low saturated fat (Swank) diets on perceived fatigue in persons with relapsing-remitting multiple sclerosis: Study protocol for a randomized controlled trial",2018,"Trials",NA,"https://www.scopus.com/inward/record.uri?partnerID=HzOxMe3b&scp=85048054036&origin=inward","https://www.scopus.com/inward/citedby.uri?partnerID=HzOxMe3b&scp=85048054036&origin=inward",84,"2021-03-18 10:42:38","Article","10.1186/s13063-018-2680-x","1745-6215","https://api.elsevier.com/content/abstract/scopus_id/85048054036",19,1,NA,NA,7,2.33,7,1,3,NA
7,"B. Casey","Objective physical activity measurement in people with multiple sclerosis: a review of the literature",2018,"Disability and Rehabilitation: Assistive Technology",NA,"https://www.scopus.com/inward/record.uri?partnerID=HzOxMe3b&scp=85038126395&origin=inward","https://www.scopus.com/inward/citedby.uri?partnerID=HzOxMe3b&scp=85038126395&origin=inward",85,"2021-03-18 10:42:38","Review","10.1080/17483107.2017.1297859","1748-3107","https://api.elsevier.com/content/abstract/scopus_id/85038126395",13,2,124,131,7,2.33,7,1,3,NA
7,"G. Dalla-Costa","Smart watch, smarter EDSS: Improving disability assessment in multiple sclerosis clinical practice",2017,"Journal of the Neurological Sciences",NA,"https://www.scopus.com/inward/record.uri?partnerID=HzOxMe3b&scp=85034785957&origin=inward","https://www.scopus.com/inward/citedby.uri?partnerID=HzOxMe3b&scp=85034785957&origin=inward",86,"2021-03-18 10:42:38","Article","10.1016/j.jns.2017.10.043","0022-510X","https://api.elsevier.com/content/abstract/scopus_id/85034785957",383,NA,166,168,7,1.75,7,1,4,NA
7,"N. Ketelhut","Functional factors that are important correlates to physical activity in people with multiple sclerosis: a pilot study",2018,"Disability and Rehabilitation",NA,"https://www.scopus.com/inward/record.uri?partnerID=HzOxMe3b&scp=85020316846&origin=inward","https://www.scopus.com/inward/citedby.uri?partnerID=HzOxMe3b&scp=85020316846&origin=inward",87,"2021-03-18 10:42:38","Article","10.1080/09638288.2017.1336647","0963-8288","https://api.elsevier.com/content/abstract/scopus_id/85020316846",40,20,2416,2423,7,2.33,7,1,3,NA
7,"E.H. Coulter","Validity of the activPAL3 activity monitor in people moderately affected by Multiple Sclerosis",2017,"Medical Engineering and Physics",NA,"https://www.scopus.com/inward/record.uri?partnerID=HzOxMe3b&scp=85017345829&origin=inward","https://www.scopus.com/inward/citedby.uri?partnerID=HzOxMe3b&scp=85017345829&origin=inward",88,"2021-03-18 10:42:38","Article","10.1016/j.medengphy.2017.03.008","1350-4533","https://api.elsevier.com/content/abstract/scopus_id/85017345829",45,NA,78,82,7,1.75,7,1,4,NA
7,"S. Kasser","Symptom variability, affect and physical activity in ambulatory persons with multiple sclerosis: Understanding patterns and time-bound relationships",2017,"Disability and Health Journal",NA,"https://www.scopus.com/inward/record.uri?partnerID=HzOxMe3b&scp=85003794626&origin=inward","https://www.scopus.com/inward/citedby.uri?partnerID=HzOxMe3b&scp=85003794626&origin=inward",89,"2021-03-18 10:42:38","Article","10.1016/j.dhjo.2016.10.006","1936-6574","https://api.elsevier.com/content/abstract/scopus_id/85003794626",10,2,207,213,7,1.75,7,1,4,NA
7,"N. Sola-Valls","Walking function in clinical monitoring of multiple sclerosis by telemedicine",2015,"Journal of Neurology",NA,"https://www.scopus.com/inward/record.uri?partnerID=HzOxMe3b&scp=84937969283&origin=inward","https://www.scopus.com/inward/citedby.uri?partnerID=HzOxMe3b&scp=84937969283&origin=inward",90,"2021-03-18 10:42:38","Article","10.1007/s00415-015-7764-x","0340-5354","https://api.elsevier.com/content/abstract/scopus_id/84937969283",262,7,1706,1713,7,1.17,7,1,6,NA
7,"I. Carpinella","Hilbert-Huang transform based instrumental assessment of intention tremor in multiple sclerosis",2015,"Journal of Neural Engineering",NA,"https://www.scopus.com/inward/record.uri?partnerID=HzOxMe3b&scp=84937501202&origin=inward","https://www.scopus.com/inward/citedby.uri?partnerID=HzOxMe3b&scp=84937501202&origin=inward",91,"2021-03-18 10:42:38","Article","10.1088/1741-2560/12/4/046011","1741-2560","https://api.elsevier.com/content/abstract/scopus_id/84937501202",12,4,NA,NA,7,1.17,7,1,6,NA
7,"P.W. Austin","Fatigue in chronic liver disease: Exploring the role of the autonomic nervous system",2015,"Liver International",NA,"https://www.scopus.com/inward/record.uri?partnerID=HzOxMe3b&scp=84927665246&origin=inward","https://www.scopus.com/inward/citedby.uri?partnerID=HzOxMe3b&scp=84927665246&origin=inward",92,"2021-03-18 10:42:38","Editorial","10.1111/liv.12784","1478-3223","https://api.elsevier.com/content/abstract/scopus_id/84927665246",35,5,1489,1491,7,1.17,7,1,6,NA
6,"O. Ulkir","Mechanical design and analysis of a pneumatic ankle foot orthosis",2018,"2018 Electric Electronics, Computer Science, Biomedical Engineerings' Meeting, EBBT 2018",NA,"https://www.scopus.com/inward/record.uri?partnerID=HzOxMe3b&scp=85050181825&origin=inward","https://www.scopus.com/inward/citedby.uri?partnerID=HzOxMe3b&scp=85050181825&origin=inward",93,"2021-03-18 10:42:38","Conference Paper","10.1109/EBBT.2018.8391461","","https://api.elsevier.com/content/abstract/scopus_id/85050181825",NA,NA,1,4,6,2,6,1,3,NA
6,"K.L. Cederberg","Physical activity, sedentary behavior, and physical function in older adults with multiple sclerosis",2018,"Journal of Aging and Physical Activity",NA,"https://www.scopus.com/inward/record.uri?partnerID=HzOxMe3b&scp=85046939034&origin=inward","https://www.scopus.com/inward/citedby.uri?partnerID=HzOxMe3b&scp=85046939034&origin=inward",94,"2021-03-18 10:42:38","Article","10.1123/japa.2016-0358","1063-8652","https://api.elsevier.com/content/abstract/scopus_id/85046939034",26,2,177,182,6,2,6,1,3,NA
6,"S. Dandu","Understanding the physiological significance of four inertial gait features in multiple sclerosis",2018,"IEEE Journal of Biomedical and Health Informatics",NA,"https://www.scopus.com/inward/record.uri?partnerID=HzOxMe3b&scp=85040374610&origin=inward","https://www.scopus.com/inward/citedby.uri?partnerID=HzOxMe3b&scp=85040374610&origin=inward",95,"2021-03-18 10:42:38","Article","10.1109/JBHI.2017.2773629","2168-2194","https://api.elsevier.com/content/abstract/scopus_id/85040374610",22,1,40,46,6,2,6,1,3,NA
6,"J. Huisinga","Coherence analysis of trunk and leg acceleration reveals altered postural sway strategy during standing in persons with multiple sclerosis",2018,"Human Movement Science",NA,"https://www.scopus.com/inward/record.uri?partnerID=HzOxMe3b&scp=85038877735&origin=inward","https://www.scopus.com/inward/citedby.uri?partnerID=HzOxMe3b&scp=85038877735&origin=inward",96,"2021-03-18 10:42:38","Article","10.1016/j.humov.2017.12.009","0167-9457","https://api.elsevier.com/content/abstract/scopus_id/85038877735",58,NA,330,336,6,2,6,1,3,NA
6,"M. Engelhard","Real-world walking in multiple sclerosis: Separating capacity from behavior",2018,"Gait and Posture",NA,"https://www.scopus.com/inward/record.uri?partnerID=HzOxMe3b&scp=85032006810&origin=inward","https://www.scopus.com/inward/citedby.uri?partnerID=HzOxMe3b&scp=85032006810&origin=inward",97,"2021-03-18 10:42:38","Article","10.1016/j.gaitpost.2017.10.015","0966-6362","https://api.elsevier.com/content/abstract/scopus_id/85032006810",59,NA,211,216,6,2,6,1,3,NA
6,"I. Vasilenko","Opportunities of QPI in the epigenetic diagnostics and assessment of therapeutic efficacy",2017,"Progress in Biomedical Optics and Imaging - Proceedings of SPIE",NA,"https://www.scopus.com/inward/record.uri?partnerID=HzOxMe3b&scp=85020465519&origin=inward","https://www.scopus.com/inward/citedby.uri?partnerID=HzOxMe3b&scp=85020465519&origin=inward",98,"2021-03-18 10:42:38","Conference Paper","10.1117/12.2253033","1605-7422","https://api.elsevier.com/content/abstract/scopus_id/85020465519",10074,NA,NA,NA,6,1.5,6,1,4,NA
6,"M. Norris","Minimum number of days required for a reliable estimate of daily step count and energy expenditure, in people with MS who walk unaided",2017,"Gait and Posture",NA,"https://www.scopus.com/inward/record.uri?partnerID=HzOxMe3b&scp=85012117643&origin=inward","https://www.scopus.com/inward/citedby.uri?partnerID=HzOxMe3b&scp=85012117643&origin=inward",99,"2021-03-18 10:42:38","Article","10.1016/j.gaitpost.2017.02.005","0966-6362","https://api.elsevier.com/content/abstract/scopus_id/85012117643",53,NA,201,206,6,1.5,6,1,4,NA
6,"J. Stellmann","Fampridine and real-life walking in multiple sclerosis: Low predictive value of clinical test for habitual short-term changes",2016,"Journal of the Neurological Sciences",NA,"https://www.scopus.com/inward/record.uri?partnerID=HzOxMe3b&scp=84979236443&origin=inward","https://www.scopus.com/inward/citedby.uri?partnerID=HzOxMe3b&scp=84979236443&origin=inward",100,"2021-03-18 10:42:38","Article","10.1016/j.jns.2016.07.051","0022-510X","https://api.elsevier.com/content/abstract/scopus_id/84979236443",368,NA,318,325,6,1.2,6,1,5,NA
6,"S.S. Ayache","Tremor in multiple sclerosis: The intriguing role of the cerebellum",2015,"Journal of the Neurological Sciences",NA,"https://www.scopus.com/inward/record.uri?partnerID=HzOxMe3b&scp=84956757743&origin=inward","https://www.scopus.com/inward/citedby.uri?partnerID=HzOxMe3b&scp=84956757743&origin=inward",101,"2021-03-18 10:42:38","Article","10.1016/j.jns.2015.09.360","0022-510X","https://api.elsevier.com/content/abstract/scopus_id/84956757743",358,1,351,356,6,1,6,1,6,NA
6,"S.S. Ayache","Analysis of tremor in multiple sclerosis using Hilbert-Huang Transform",2015,"Neurophysiologie Clinique",NA,"https://www.scopus.com/inward/record.uri?partnerID=HzOxMe3b&scp=84949319426&origin=inward","https://www.scopus.com/inward/citedby.uri?partnerID=HzOxMe3b&scp=84949319426&origin=inward",102,"2021-03-18 10:42:38","Article","10.1016/j.neucli.2015.09.013","0987-7053","https://api.elsevier.com/content/abstract/scopus_id/84949319426",45,6,475,484,6,1,6,1,6,NA
6,"C. Fjeldstad","Use of accelerometers to measure real-life physical activity in ambulatory individuals with multiple sclerosis",2015,"International Journal of MS Care",NA,"https://www.scopus.com/inward/record.uri?partnerID=HzOxMe3b&scp=84945296115&origin=inward","https://www.scopus.com/inward/citedby.uri?partnerID=HzOxMe3b&scp=84945296115&origin=inward",103,"2021-03-18 10:42:38","Article","10.7224/1537-2073.2014-037","1537-2073","https://api.elsevier.com/content/abstract/scopus_id/84945296115",17,5,215,220,6,1,6,1,6,NA
6,"S. Brændvik","Treadmill Training or Progressive Strength Training to Improve Walking in People with Multiple Sclerosis? A Randomized Parallel Group Trial",2016,"Physiotherapy Research International",NA,"https://www.scopus.com/inward/record.uri?partnerID=HzOxMe3b&scp=84933074100&origin=inward","https://www.scopus.com/inward/citedby.uri?partnerID=HzOxMe3b&scp=84933074100&origin=inward",104,"2021-03-18 10:42:38","Article","10.1002/pri.1636","1358-2267","https://api.elsevier.com/content/abstract/scopus_id/84933074100",21,4,228,236,6,1.2,6,1,5,NA
5,"G. Defer","Dedicated mobile application for drug adverse reaction reporting by patients with relapsing remitting multiple sclerosis (Vigip-SEP study): Study protocol for a randomized controlled trial",2018,"Trials",NA,"https://www.scopus.com/inward/record.uri?partnerID=HzOxMe3b&scp=85043452996&origin=inward","https://www.scopus.com/inward/citedby.uri?partnerID=HzOxMe3b&scp=85043452996&origin=inward",105,"2021-03-18 10:42:38","Article","10.1186/s13063-018-2560-4","1745-6215","https://api.elsevier.com/content/abstract/scopus_id/85043452996",19,1,NA,NA,5,1.67,5,1,3,NA
5,"E. Sebastião","Lower Physical Activity in Persons with Multiple Sclerosis at Increased Fall Risk",2017,"American Journal of Physical Medicine and Rehabilitation",NA,"https://www.scopus.com/inward/record.uri?partnerID=HzOxMe3b&scp=85018619997&origin=inward","https://www.scopus.com/inward/citedby.uri?partnerID=HzOxMe3b&scp=85018619997&origin=inward",106,"2021-03-18 10:42:38","Article","10.1097/PHM.0000000000000581","0894-9115","https://api.elsevier.com/content/abstract/scopus_id/85018619997",96,5,357,361,5,1.25,5,1,4,NA
5,"R.E. Klaren","Patterns and predictors of change in moderate-to-vigorous physical activity over time in multiple sclerosis",2017,"Journal of Physical Activity and Health",NA,"https://www.scopus.com/inward/record.uri?partnerID=HzOxMe3b&scp=85017140294&origin=inward","https://www.scopus.com/inward/citedby.uri?partnerID=HzOxMe3b&scp=85017140294&origin=inward",107,"2021-03-18 10:42:38","Article","10.1123/jpah.2016-0335","1543-3080","https://api.elsevier.com/content/abstract/scopus_id/85017140294",14,3,183,188,5,1.25,5,1,4,NA
5,"M. Nezerwa","Universal design with mobile app development: Bridging the Gap for the forgotten populations",2015,"2015 IEEE Long Island Systems, Applications and Technology Conference, LISAT 2015",NA,"https://www.scopus.com/inward/record.uri?partnerID=HzOxMe3b&scp=84941241823&origin=inward","https://www.scopus.com/inward/citedby.uri?partnerID=HzOxMe3b&scp=84941241823&origin=inward",108,"2021-03-18 10:42:38","Conference Paper","10.1109/LISAT.2015.7160201","","https://api.elsevier.com/content/abstract/scopus_id/84941241823",NA,NA,NA,NA,5,0.83,5,1,6,NA
4,"H. Nakagawa","Biochemical properties of TAK-828F, a potent and selective retinoid-related orphan receptor gamma t inverse agonist",2018,"Pharmacology",NA,"https://www.scopus.com/inward/record.uri?partnerID=HzOxMe3b&scp=85056734140&origin=inward","https://www.scopus.com/inward/citedby.uri?partnerID=HzOxMe3b&scp=85056734140&origin=inward",109,"2021-03-18 10:42:38","Article","10.1159/000492226","0031-7012","https://api.elsevier.com/content/abstract/scopus_id/85056734140",102,5,244,252,4,1.33,4,1,3,NA
4,"R. Dennett","Effectiveness of and user experience with web-based interventions in increasing physical activity levels in people with multiple sclerosis: A systematic review",2018,"Physical Therapy",NA,"https://www.scopus.com/inward/record.uri?partnerID=HzOxMe3b&scp=85055314822&origin=inward","https://www.scopus.com/inward/citedby.uri?partnerID=HzOxMe3b&scp=85055314822&origin=inward",110,"2021-03-18 10:42:38","Review","10.1093/PTJ/PZY060","0031-9023","https://api.elsevier.com/content/abstract/scopus_id/85055314822",98,8,679,690,4,1.33,4,1,3,NA
4,"B. Sirhan","Is the dual-task cost of walking and texting unique in people with multiple sclerosis?",2018,"Journal of Neural Transmission",NA,"https://www.scopus.com/inward/record.uri?partnerID=HzOxMe3b&scp=85054720084&origin=inward","https://www.scopus.com/inward/citedby.uri?partnerID=HzOxMe3b&scp=85054720084&origin=inward",111,"2021-03-18 10:42:38","Article","10.1007/s00702-018-1939-4","0300-9564","https://api.elsevier.com/content/abstract/scopus_id/85054720084",125,12,1829,1835,4,1.33,4,1,3,NA
4,"J. Gong","Correlations between inertial body sensor measures and clinical measures in multiple sclerosis",2015,"BodyNets International Conference on Body Area Networks",NA,"https://www.scopus.com/inward/record.uri?partnerID=HzOxMe3b&scp=85052172659&origin=inward","https://www.scopus.com/inward/citedby.uri?partnerID=HzOxMe3b&scp=85052172659&origin=inward",112,"2021-03-18 10:42:38","Conference Paper","10.4108/eai.28-9-2015.2261504","2310-3582","https://api.elsevier.com/content/abstract/scopus_id/85052172659",NA,NA,NA,NA,4,0.67,4,1,6,NA
4,"T.B. Willingham","Effect of antigravity treadmill training on muscle oxidative capacity, muscle endurance, and walking function in a person with multiple sclerosis",2018,"International Journal of MS Care",NA,"https://www.scopus.com/inward/record.uri?partnerID=HzOxMe3b&scp=85052144445&origin=inward","https://www.scopus.com/inward/citedby.uri?partnerID=HzOxMe3b&scp=85052144445&origin=inward",113,"2021-03-18 10:42:38","Article","10.7224/1537-2073.2017-035","1537-2073","https://api.elsevier.com/content/abstract/scopus_id/85052144445",20,4,186,190,4,1.33,4,1,3,NA
4,"T.J. Cheng","Characterisation of rollator use using inertial sensors",2016,"Healthcare Technology Letters",NA,"https://www.scopus.com/inward/record.uri?partnerID=HzOxMe3b&scp=85041822363&origin=inward","https://www.scopus.com/inward/citedby.uri?partnerID=HzOxMe3b&scp=85041822363&origin=inward",114,"2021-03-18 10:42:38","Article","10.1049/htl.2016.0061","2053-3713","https://api.elsevier.com/content/abstract/scopus_id/85041822363",3,4,303,309,4,0.8,4,1,5,NA
4,"L. Lonini","Automatic detection of Spasticity from flexible wearable sensors",2017,"UbiComp/ISWC 2017 - Adjunct Proceedings of the 2017 ACM International Joint Conference on Pervasive and Ubiquitous Computing and Proceedings of the 2017 ACM International Symposium on Wearable Computers",NA,"https://www.scopus.com/inward/record.uri?partnerID=HzOxMe3b&scp=85030859453&origin=inward","https://www.scopus.com/inward/citedby.uri?partnerID=HzOxMe3b&scp=85030859453&origin=inward",115,"2021-03-18 10:42:38","Conference Paper","10.1145/3123024.3123098","","https://api.elsevier.com/content/abstract/scopus_id/85030859453",NA,NA,133,136,4,1,4,1,4,NA
4,"L. Lorefice","‘Timed up and go’ and brain atrophy: a preliminary MRI study to assess functional mobility performance in multiple sclerosis",2017,"Journal of Neurology",NA,"https://www.scopus.com/inward/record.uri?partnerID=HzOxMe3b&scp=85029030563&origin=inward","https://www.scopus.com/inward/citedby.uri?partnerID=HzOxMe3b&scp=85029030563&origin=inward",116,"2021-03-18 10:42:38","Article","10.1007/s00415-017-8612-y","0340-5354","https://api.elsevier.com/content/abstract/scopus_id/85029030563",264,11,2201,2204,4,1,4,1,4,NA
4,"A. Ortlieb","AUTONOMYO: Design challenges of lower limb assistive device for elderly people, multiple sclerosis and neuromuscular diseases",2017,"Biosystems and Biorobotics",NA,"https://www.scopus.com/inward/record.uri?partnerID=HzOxMe3b&scp=85028473525&origin=inward","https://www.scopus.com/inward/citedby.uri?partnerID=HzOxMe3b&scp=85028473525&origin=inward",117,"2021-03-18 10:42:38","Chapter","10.1007/978-3-319-46532-6_72","2195-3562","https://api.elsevier.com/content/abstract/scopus_id/85028473525",16,NA,439,443,4,1,4,1,4,NA
4,"A. Aburub","The association between physical activity and sleep characteristics in people with multiple sclerosis",2017,"Multiple Sclerosis and Related Disorders",NA,"https://www.scopus.com/inward/record.uri?partnerID=HzOxMe3b&scp=85008336821&origin=inward","https://www.scopus.com/inward/citedby.uri?partnerID=HzOxMe3b&scp=85008336821&origin=inward",118,"2021-03-18 10:42:38","Article","10.1016/j.msard.2016.12.010","2211-0348","https://api.elsevier.com/content/abstract/scopus_id/85008336821",12,NA,29,33,4,1,4,1,4,NA
