,Author.Names,Title,Source.title,Publication.Year,Abstract,Publication.Type,DOI,ID,database,yvonne_included,yvonne_excluded,yvonne_comments,catherine_included,catherine_excluded,catherine_comment,tim,tim_comment
427,"Matthies, DJC; Haescher, M; Nanayakkara, S; Bieber, G",Step Detection for Rollator Users with Smartwatches,SUI'18: PROCEEDINGS OF THE 2018 SYMPOSIUM ON SPATIAL USER INTERACTION,2016,"Smartwatches enable spatial user input, namely for the continuous tracking of physical activity and relevant health parameters. Additionally, smartwatches are experiencing greater social acceptability, even among the elderly. While step counting is an essential parameter to calculate the user's spatial activity, current detection algorithms are insufficient for calculating steps when using a rollator, which is a common walking aid for elderly people. Through a pilot study conducted with eight different wrist-worn smart devices, an overall recognition of similar to 10% was achieved. This is because characteristic motions utilized by step counting algorithms are poorly reflected at the user's wrist when pushing a rollator. This issue is also present among other spatial activities such as pushing a pram, a bike, and a shopping cart. This paper thus introduces an improved step counting algorithm for wrist-worn accelerometers. This new algorithm was first evaluated through a controlled study and achieved promising results with an overall recognition of similar to 85%. As a follow-up, a preliminary field study with randomly selected elderly people who used rollators resulted in similar detection rates of similar to 83%. To conclude, this research will expectantly contribute to greater step counting precision in smart wearable technology.",Proceedings Paper,10.1145/3267782.3267784,WOS:000493133300020,WoS,Yes,,,no,Conference proceeding,,Out of scope (topic),"no MS patients, interesting"
429,"Van Der Logt R.P., Findling O., Rust H., Yaldizli O., Allum J.H.J.",The effect of vibrotactile biofeedback of trunk sway on balance control in multiple sclerosis,Multiple Sclerosis and Related Disorders,2016,"Background Patients with multiple sclerosis (MS) suffer from diminished balance control due to slowed sensory conduction and possibly delayed central processing. Vibrotactile biofeedback of trunk sway has been shown to improve balance control in patients with peripheral and central vestibular disorders. Here, the effects of vibrotactile feedback training on trunk sway and a possible carry-over effect was measured in MS patients during stance and gait. Methods Ten MS patients (mean age 46.8±7.7 years, 40% male) participated in a crossover study in which 7 different stance and gait tasks were trained with and without angle feedback for stance and angular velocity feedback for gait. An assessment sequence of 12 tasks was performed once before and twice after the training sequence. Trunk sway was measured with body-worn gyroscopes. Head mounted vibrotactile biofeedback of trunk sway was provided during one crossover training arm and the following second assessment sequence. Results Biofeedback generally leads to a decrease in sway but an increase in sway angular velocities during some stance tasks compared to training without biofeedback. Biofeedback while walking eyes open resulted in a decreased sway angular velocity. The greatest changes were found in the pitch direction of trunk sway. Effects diminished after biofeedback was removed. Conclusions This study showed that vibrotactile biofeedback of trunk sway beneficially effects stance and provides significant improvement in gait compared to training without biofeedback in MS patients.",Article,10.1016/J.MSARD.2016.05.003,http://sfx.metabib.ch/sfx_locater?sid=EMBASE&issn=22110356&id=doi:10.1016%2Fj.msard.2016.05.003&atitle=The+effect+of+vibrotactile+biofeedback+of+trunk+sway+on+balance+control+in+multiple+sclerosis&stitle=Mult.+Scler.+Relat.+Disord.&title=Multiple+Sclerosis+and+Related+Disorders&volume=8&issue=&spage=58&epage=63&aulast=Van+Der+Logt&aufirst=R.P.&auinit=R.P.&aufull=Van+Der+Logt+R.P.&coden=&isbn=&pages=58-63&date=2016&auinit1=R&auinitm=P,Embase,Yes,,,no,Out of scope,,Out of scope (topic),"wearable for therapy, not diagnostic"
436,"Braendvik S.M., Koret T., Helbostad J.L., Lorås H., Bråthen G., Hovdal H.O., Aamot I.L.",Treadmill Training or Progressive Strength Training to Improve Walking in People with Multiple Sclerosis? A Randomized Parallel Group Trial,Physiotherapy research international : the journal for researchers and clinicians in physical therapy,2016,"BACKGROUND AND PURPOSE: The most effective treatment approach to improve walking in people with multiple sclerosis (MS) is not known. The aim of this trial was to assess the efficacy of treadmill training and progressive strength training on walking in people with MS.METHODS: A single blinded randomized parallel group trial was carried out. Eligible participants were adults with MS with Expanded Disability Status Scale score ?6. A total of 29 participants were randomized and 28 received the allocated exercise intervention, treadmill (n?=?13) or strength training (n?=?15). Both groups exercised 30?minutes, three times a week for 8?weeks. Primary outcome was The Functional Ambulation Profile evaluated by the GAITRite walkway. Secondary outcomes were walking work economy and balance control during walking, measured by a small lightweight accelerometer connected to the lower back. Testing was performed at baseline and the subsequent week after completion of training.RESULTS: Two participants were lost to follow-up, and 11 (treadmill) and 15 (strength training) were left for analysis. The treadmill group increased their Functional Ambulation Profile score significantly compared with the strength training group (p?=?.037). A significant improvement in walking work economy (p?=?.024) and a reduction of root mean square of vertical acceleration (p?=?.047) also favoured the treadmill group.DISCUSSION: The results indicate that task-specific training by treadmill walking is a favourable approach compared with strength training to improve walking in persons with mild and moderate MS. Implications for Physiotherapy practice, this study adds knowledge for the decision of optimal treatment approaches in people with MS. Copyright © 2015 John Wiley & Sons, Ltd.",Article,10.1002/PRI.1636,http://sfx.metabib.ch/sfx_locater?sid=EMBASE&issn=14712865&id=doi:10.1002%2Fpri.1636&atitle=Treadmill+Training+or+Progressive+Strength+Training+to+Improve+Walking+in+People+with+Multiple+Sclerosis%3F+A+Randomized+Parallel+Group+Trial&stitle=Physiother+Res+Int&title=Physiotherapy+research+international+%3A+the+journal+for+researchers+and+clinicians+in+physical+therapy&volume=21&issue=4&spage=228&epage=236&aulast=Braendvik&aufirst=Siri+Merete&auinit=S.M.&aufull=Braendvik+S.M.&coden=&isbn=&pages=228-236&date=2016&auinit1=S&auinitm=M,Embase,Yes,,,no,Out of scope,,included,accelerometer used as outcome measure
442,"Lorefice L., Coghe G., Fenu G., Porta M., Pilloni G., Frau J., Corona F., Sechi V., Barracciu M.A., Marrosu M.G., Pau M., Cocco E.",Timed up and go and brain atrophy: a preliminary MRI study to assess functional mobility performance in multiple sclerosis,Journal of Neurology,2017,"Motor and cognitive disabilities are related to brain atrophy in multiple sclerosis (MS). Timed up and go (TUG) has been recently tested in MS as functional mobility test, as it is able to evaluate ambulation/coordination-related tasks, as well as cognitive function related to mobility. The objective of this study is to evaluate the relationship between brain volumes and TUG performances. Inclusion criteria were a diagnosis of MS and the ability to walk at least 20 m. TUG was performed using a wearable inertial sensor. Times and velocities of TUG sub-phases were calculated by processing trunk acceleration data. Patients underwent to a brain MRI, and volumes of whole brain, white matter (WM), grey matter (GM), and cortical GM (C) were estimated with SIENAX. Sixty patients were enrolled. Mean age was 41.5 ± 11.6 years and mean EDSS 2.3 ± 1.2. Total TUG duration was correlated to lower WM (? = 0.358, p = 0.005) and GM (? = 0.309, p = 0.017) volumes. A stronger association with lower GM volume was observed for intermediate (? = 0.427, p = 0.001) and final turning (? = 0.390, p = 0.002). TUG is a useful tool in a clinical setting as it can not only evaluate patients disability in terms of impaired functional mobility, but also estimate pathological features, such as grey atrophy.",Article,10.1007/S00415-017-8612-Y,http://sfx.metabib.ch/sfx_locater?sid=EMBASE&issn=14321459&id=doi:10.1007%2Fs00415-017-8612-y&atitle=%E2%80%98Timed+up+and+go%E2%80%99+and+brain+atrophy%3A+a+preliminary+MRI+study+to+assess+functional+mobility+performance+in+multiple+sclerosis&stitle=J.+Neurol.&title=Journal+of+Neurology&volume=264&issue=11&spage=2201&epage=2204&aulast=Lorefice&aufirst=Lorena&auinit=L.&aufull=Lorefice+L.&coden=JNRYA&isbn=&pages=2201-2204&date=2017&auinit1=L&auinitm=,Embase,Yes,,,no,Out of scope,,included,accelerometer used as outcome measure
463,A. Qureshi,Demonstrating the real-world significance of the mid-swing to heel strike part of the gait cycle using spectral features,"2017 IEEE 14th International Conference on Wearable and Implantable Body Sensor Networks, BSN 2017",2017,NA,Conference Paper,10.1109/BSN.2017.7936025,https://www.scopus.com/inward/record.uri?partnerID=HzOxMe3b&scp=85025459263&origin=inward,Scopus,No,Out of scope (topic),,yes,,Conference paper with sufficient data,included,
488,"Sebastião E., Learmonth Y.C., Motl R.W.",Lower Physical Activity in Persons with Multiple Sclerosis at Increased Fall Risk: A Cross-sectional Study,American journal of physical medicine & rehabilitation,2017,"Persons with multiple sclerosis (MS) often report being afraid of falling, and this may have effects on physical activity (PA) engagement. This study investigated PA levels in persons with MS as a function of fall risk categories. Forty-seven persons with MS participated in the study and were categorized into either increased fall risk (IFR; n = 21; 55.5 ± 9.0 years) or normal fall risk (NFR; n = 26; 51.2 ± 12.9 years) groups based on scores from the Activities-Balance Confidence scale. PA was measured by accelerometer and expressed as average steps per day, and time spent in sedentary behavior, light PA, and moderate to vigorous physical activity over the course of 7 consecutive days. Univariate and covariate analyses were used to compare the differences in PA between fall risk groups. The average steps per day of the NFR group was significant higher compared with the IFR group (6024 ± 2533.1 vs. 2599 ± 1622.7 steps; P < 0.001), and the difference remained after controlling for disability level (5351 ± 2298.6 vs. 3432 ± 2363.6 steps; P = 0.016). There were no differences in light PA and moderate to vigorous physical activity between groups after controlling for disability level. Persons with MS at IFR accumulate fewer steps per day compared with those at NFR. This underscores the need for well-designed interventions targeting walking in this population who are far from the recommended 10,000 steps, particularly those with IFR.",Article,10.1097/PHM.0000000000000581,http://sfx.metabib.ch/sfx_locater?sid=EMBASE&issn=15377385&id=doi:10.1097%2FPHM.0000000000000581&atitle=Lower+Physical+Activity+in+Persons+with+Multiple+Sclerosis+at+Increased+Fall+Risk%3A+A+Cross-sectional+Study&stitle=Am+J+Phys+Med+Rehabil&title=American+journal+of+physical+medicine+%26+rehabilitation&volume=96&issue=5&spage=357&epage=361&aulast=Sebasti%C3%A3o&aufirst=Emerson&auinit=E.&aufull=Sebasti%C3%A3o+E.&coden=&isbn=&pages=357-361&date=2017&auinit1=E&auinitm=,Embase,Yes,,,no,Out of scope,,included,accelerometer used as outcome measure
497,"Klaren R.E., Hubbard E.A., Wetter N.C., Sutton B.P., Motl R.W.",Objectively measured sedentary behavior and brain volumetric measurements in multiple sclerosis,Neurodegenerative Disease Management,2017,"Aim: This study examined the association between sedentary behavior patterns and whole brain gray matter (GM), white matter (WM) and subcortical GM structures in persons with multiple sclerosis (MS). Methods: 36 persons with MS wore an accelerometer and underwent a brain MRI. Whole brain GM and WM and deep GM structures were calculated from 3D T1-weighted structural brain images. Results: There were statistically significant (p < 0.01) and moderate or large associations between number of sedentary bouts/day and brain volume measures. The primary result was a consistent negative association between number of sedentary bouts/day and whole brain GM and WM, and deep GM structures. Conclusion: We provide novel evidence for decreased brain volume as a correlate of a sedentary behavior pattern in persons with MS.",Article,10.2217/NMT-2016-0036,http://sfx.metabib.ch/sfx_locater?sid=EMBASE&issn=17582032&id=doi:10.2217%2Fnmt-2016-0036&atitle=Objectively+measured+sedentary+behavior+and+brain+volumetric+measurements+in+multiple+sclerosis&stitle=Neurodegenerative+Dis.+Manage.&title=Neurodegenerative+Disease+Management&volume=7&issue=1&spage=31&epage=37&aulast=Klaren&aufirst=Rachel+E.&auinit=R.E.&aufull=Klaren+R.E.&coden=&isbn=&pages=31-37&date=2017&auinit1=R&auinitm=E,Embase,No,Out of scope (topic),,yes,,,included,accelerometer used as outcome measure
517,"Kasser S.L., Goldstein A., Wood P.K., Sibold J.","Symptom variability, affect and physical activity in ambulatory persons with multiple sclerosis: Understanding patterns and time-bound relationships",Disability and Health Journal,2017,"Background Individuals with multiple sclerosis (MS) experience a clinical course that is highly variable with daily fluctuations in symptoms significantly affecting functional ability and quality of life. Yet, understanding how MS symptoms co-vary and associate with physical and psychological health is unclear. Objective The purpose of the study was to explore variability patterns and time-bound relationships across symptoms, affect, and physical activity in individuals with MS. Methods The study employed a multivariate, replicated, single-subject repeated-measures (MRSRM) design and involved four individuals with MS. Mood, fatigue, pain, balance confidence, and losses of balance were measured daily over 28 days by self-report. Physical activity was also measured daily over this same time period via accelerometry. Dynamic factor analysis (DFA) was used to determine the dimensionality and lagged relationships across the variables. Results Person-specific models revealed considerable time-dependent co-variation patterns as well as pattern variation across subjects. Results also offered insight into distinct variability structures at varying levels of disability. Conclusion Modeling person-level variability may be beneficial for addressing the heterogeneity of experiences in individuals with MS and for understanding temporal and dynamic interrelationships among perceived symptoms, affect, and health outcomes in this group.",Article,10.1016/J.DHJO.2016.10.006,http://sfx.metabib.ch/sfx_locater?sid=EMBASE&issn=18767583&id=doi:10.1016%2Fj.dhjo.2016.10.006&atitle=Symptom+variability%2C+affect+and+physical+activity+in+ambulatory+persons+with+multiple+sclerosis%3A+Understanding+patterns+and+time-bound+relationships&stitle=Disabil.+Health+J.&title=Disability+and+Health+Journal&volume=10&issue=2&spage=207&epage=213&aulast=Kasser&aufirst=Susan+L.&auinit=S.L.&aufull=Kasser+S.L.&coden=&isbn=&pages=207-213&date=2017&auinit1=S&auinitm=L,Embase,No,Out of scope (topic),,yes,,,Out of scope (outcomes),interesting
518,"Aburub A., Khalil H., Al-Sharman A., Alomari M., Khabour O.",The association between physical activity and sleep characteristics in people with multiple sclerosis,Multiple Sclerosis and Related Disorders,2017,"Study objectives The majority of individuals with multiple sclerosis (MS) suffer from sleep disorders. In this study, we investigated the relationship between physical activity and sleep characteristics in MS patients. Methods Sixty MS patients were recruited in the study. Sleep characteristics were assessed using the Actisleep device while physical activity levels were assessed using mobility accelerometer. Results The results showed that means (±SD) of sleep latency (SL) and sleep efficiency (ES) for MS patients were 23.89±13.23 min and 87.52±76.89% respectively. The participants total time in sleep (TST) and wake after sleep onset (WASO) were 353.25±63.98 min and 83.84±42.23 min respectively. With respect to physical activity levels, means (±SD) of light (LA), moderate (MA), vigorous (VA) activities and moderate to vigorous physical activity (MVPA) were 11,660.15±18,145, 212.04±148.67, 9.70±9.26 and 222.88±154.60 counts per minute, respectively. Pearson's correlation analysis showed that WASO correlated significantly with LA, MA and MVPA (P<0.05). These correlations remained significant even after accounting for age, body weight and disease severity (P<0.05). Conclusion The results show a positive relationship of physical activity with sleep parameters in individuals with MS.",Article,10.1016/J.MSARD.2016.12.010,http://sfx.metabib.ch/sfx_locater?sid=EMBASE&issn=22110356&id=doi:10.1016%2Fj.msard.2016.12.010&atitle=The+association+between+physical+activity+and+sleep+characteristics+in+people+with+multiple+sclerosis&stitle=Mult.+Scler.+Relat.+Disord.&title=Multiple+Sclerosis+and+Related+Disorders&volume=12&issue=&spage=29&epage=33&aulast=Aburub&aufirst=Aseel&auinit=A.&aufull=Aburub+A.&coden=&isbn=&pages=29-33&date=2017&auinit1=A&auinitm=,Embase,No,Out of scope (outcomes)/Teamdiscussion,,yes,,,included,accelerometer used as outcome measure
522,"Lorefice L., Coghe G., Fenu G., Porta M., Pilloni G., Frau J., Corona F., Marrosu M.G., Pau M., Cocco E.",Timed up and go and brain atrophy: A preliminary MRI study to assess functional mobility performance in multiple sclerosis,Multiple Sclerosis Journal,2017,"Background: Mobility impairment is one of the most disabling problems and cause of comorbidity (eg. falls and bone injuries) in MS. Timed up and go (TUG) is a widely used measure of functional mobility and an instrumented TUG which make use of inertial sensors has been recently tested in MS (Pau et al., 2017). This approach allows obtaining time, acceleration and velocities of each TUG sub-phase (i.e. sit-tostand, intermediate and final turning, stand-to-sit). In addition, as it is based on open-task, TUG evaluate also programming, planning, navigation and other executive functions. Since clinical disabilities, especially motor and cognitive impairment, are highly related to brain atrophy (Charil, A., et al., 2006), and TUG is able to combine these abilities in a single task, the purpose of this study was to evaluate relationship between brain volumes and instrumented TUG (iTUG) performances. Methods: Inclusion criteria for enrollment were a diagnosis of MS according to McDonald criteria and been able to walk at least 20m. iTUG was performed using a wearable inertial sensor as previously reported by Pau et al. Times and velocities of TUG subphases were calculated by processing the trunk accleeration data. .All patients underwent to a brain MRI and volumes of whole brain (WB), white matter (WM), grey matter (GM) and cortical GM (C) were estimated with SIENAX (Smith et al., 2002). Relationship between brain volumes and TUG parameters were assessed by means of Spearman correlation. Results: Sixty patients were enrolled (19 male); mean age was 41.5±11.6 years and mean EDSS was 2.3±1.2. The following significant correlations were found: total TUG duration with WB (Rho=0.270 p=0.038), WM (Rho=0.358 p=0.005), GM (Rho=0.309 p=0.017), C (Rho=0.317 p=0.014); for intermediate turning: mean velocity with WB (Rho=0.365 p=0.004), WM (Rho=0.331 p=0.10), GM (Rho= 0.427 p=0.001), C (Rho=0.380 p=0.003), and maximal velocity with WB (Rho= 0.274 p=0.035), GM (Rho=0.377 p=0.003), C (Rho=0.351 p=0.006). For the final turning: mean velocity with WM (Rho=0.256 p=0.042), GM (Rho=0.350 p=0.007), C (Rho=0.304 p=0.019) and maximal velocity with WB (Rho=0.265 p=0.043), GM (Rho=0.390 p=0.002), C (Rho=0.400 p=0.002). Conclusions: iTUG is a very useful tool in clinical setting as it can not only evaluate patients' disability in terms of impaired functional mobility, but also estimate pathological features such as cortical atrophy.",Conference Abstract,10.1177/1352458517731404,http://sfx.metabib.ch/sfx_locater?sid=EMBASE&issn=14770970&id=doi:10.1177%2F1352458517731404&atitle=Timed+up+and+go+and+brain+atrophy%3A+A+preliminary+MRI+study+to+assess+functional+mobility+performance+in+multiple+sclerosis&stitle=Mult.+Scler.+J.&title=Multiple+Sclerosis+Journal&volume=23&issue=3&spage=156&epage=&aulast=Lorefice&aufirst=L.&auinit=L.&aufull=Lorefice+L.&coden=&isbn=&pages=156-&date=2017&auinit1=L&auinitm=,Embase,Yes,,,no,Abstract,,Abstract only,
528,"El-Gohary M., Peterson D., Gera G., Horak F.B., Huisinga J.M.",Validity of the Instrumented Push and Release Test to Quantify Postural Responses in Persons With Multiple Sclerosis,Archives of Physical Medicine and Rehabilitation,2017,"Objective To test the validity of wearable inertial sensors to provide objective measures of postural stepping responses to the push and release clinical test in people with multiple sclerosis. Design Cross-sectional study. Setting University medical center balance disorder laboratory. Participants Total sample N=73; persons with multiple sclerosis (PwMS) n=52; healthy controls n=21. Main Outcome Measures Stepping latency, time and number of steps required to reach stability, and initial step length were calculated using 3 inertial measurement units placed on participants' lumbar spine and feet. Results Correlations between inertial sensor measures and measures obtained from the laboratory-based systems were moderate to strong and statistically significant for all variables: time to release (r=.992), latency (r=.655), time to stability (r=.847), time of first heel strike (r=.665), number of steps (r=.825), and first step length (r=.592). Compared with healthy controls, PwMS demonstrated a longer time to stability and required a larger number of steps to reach stability. Conclusions The instrumented push and release test is a valid measure of postural responses in PwMS and could be used as a clinical outcome measures for patient care decisions or for clinical trials aimed at improving postural control in PwMS.",Article,10.1016/J.APMR.2017.01.030,http://sfx.metabib.ch/sfx_locater?sid=EMBASE&issn=1532821X&id=doi:10.1016%2Fj.apmr.2017.01.030&atitle=Validity+of+the+Instrumented+Push+and+Release+Test+to+Quantify+Postural+Responses+in+Persons+With+Multiple+Sclerosis&stitle=Arch.+Phys.+Med.+Rehabil.&title=Archives+of+Physical+Medicine+and+Rehabilitation&volume=98&issue=7&spage=1325&epage=1331&aulast=El-Gohary&aufirst=Mahmoud&auinit=M.&aufull=El-Gohary+M.&coden=APMHA&isbn=&pages=1325-1331&date=2017&auinit1=M&auinitm=,Embase,Yes,,,no,Out of scope,,included,
544,S. Rihana,Artificial neural network for sit-to-stand classification based on inertial measurement units data,CEUR Workshop Proceedings,2018,NA,Conference Paper,NA,https://www.scopus.com/inward/record.uri?partnerID=HzOxMe3b&scp=85066489588&origin=inward,Scopus,No,Out of scope (topic),,yes,,Wearable IMUs,Out of scope (outcomes),"multiple IMU, HAR"
