,Author.Names,Title,Source.title,Publication.Year,Abstract,Publication.Type,DOI,ID,database,yvonne_included,yvonne_excluded,yvonne_comments,catherine_included,catherine_excluded,catherine_comment,tim,tim_comment
211,"Hilfiker R., Vaney C., Gattlen B., Meichtry A., Deriaz O., Lugon-Moulin V., Anchisi-Bellwald A.M., Palaci C., Foinant D., Terrier P.",Local dynamic stability as a responsive index for the evaluation of rehabilitation effect on fall risk in patients with multiple sclerosis: a longitudinal study.,BMC research notes,2013,"Gait and balance problems are common in patients with multiple sclerosis, leading to high risk for falls. Local Dynamic Stability (LDS), a non-linear gait stability index, has been advocated as an early indicator of risk for falls. With this longitudinal study over three weeks, we aimed to assess the responsiveness of Local Dynamic Stability to a rehabilitation program and to compare it to other measures. Eighteen patients (mean 54 years, median EDSS score: 5) participated. They were admitted to inpatient rehabilitation and received a three weeks individually tailored program. They performed a 3-minute walking test at the beginning and at the end of the stay, as well as pain, wellbeing, fatigue, and balance assessment. The Local Dynamic Stability was computed from the acceleration signals measured with a 3D-accelerometer. At the end of the rehabilitation process, patients reported reduced pain (Effect Size: -0.7), fatigue (ES:-0.6), and increased wellbeing (ES: 1.1). A small positive effect on static balance was observed (ES: 0.3). LDS was improved (ES: 0.6), and the effect was higher than walking speed improvement (ES: 0.4). The Local Dynamic Stability seemed responsive to assess rehabilitation effects in patients with multiple sclerosis. It could constitute a valuable gait quality index, which could evaluate potential effects of rehabilitation on fall risk. Current Controlled Trials ISRCTN69803702.",Article,10.1186/1756-0500-6-260,http://sfx.metabib.ch/sfx_locater?sid=EMBASE&issn=17560500&id=doi:10.1186%2F1756-0500-6-260&atitle=Local+dynamic+stability+as+a+responsive+index+for+the+evaluation+of+rehabilitation+effect+on+fall+risk+in+patients+with+multiple+sclerosis%3A+a+longitudinal+study.&stitle=BMC+Res+Notes&title=BMC+research+notes&volume=6&issue=&spage=260&epage=&aulast=Hilfiker&aufirst=Roger&auinit=R.&aufull=Hilfiker+R.&coden=&isbn=&pages=260-&date=2013&auinit1=R&auinitm=,Embase,Yes,,,no,Out of scope,,Out of scope (outcomes),accelerometer used as outcome measure but no correlation
218,"Lamers I., Kerkhofs L., Raats J., Kos D., Van Wijmeersch B., Feys P.",Perceived and actual arm performance in multiple sclerosis: Relationship with clinical tests according to hand dominance,Multiple Sclerosis Journal,2013,"Background: The real-life relevance of frequently applied clinical arm tests is not well known in multiple sclerosis (MS). Objective: This study aimed to determine the relation between real-life arm performance and clinical tests in MS. Methods: Thirty wheelchair-bound MS patients and 30 healthy controls were included. Actual and perceived real-life arm performance was measured by using accelerometry and a self-reported measure (Motor Activity Log). Clinical tests on 'body functions and structures' (JAMAR handgrip strength, Motricity Index (MI), Fugl Meyer (FM)) and 'activity' level (Nine Hole Peg Test (NHPT), Action Research Arm test) of the International Classification of Functioning were conducted. Statistical analyses were performed separately for current dominant and non-dominant arm. Results: For all outcome measures, MS patients scored with both arms significantly lower than the control group. Higher correlations between actual arm performance and clinical tests were found for the non-dominant arm (0.63-0.80). The FM (55%) was a good predictor of actual arm performance, while the MI (46%) and NHPT (55%) were good predictors of perceived arm performance. Conclusions: Real-life arm performance is decreased in wheelchair-bound MS patients and can be best predicted by measures on 'body functions and structures' level and fine motor control. Hand dominance influenced the magnitude of relationships. © 2013 The Author(s).",Article,10.1177/1352458513475832,http://sfx.metabib.ch/sfx_locater?sid=EMBASE&issn=14770970&id=doi:10.1177%2F1352458513475832&atitle=Perceived+and+actual+arm+performance+in+multiple+sclerosis%3A+Relationship+with+clinical+tests+according+to+hand+dominance&stitle=Mult.+Scler.+J.&title=Multiple+Sclerosis+Journal&volume=19&issue=10&spage=1341&epage=1348&aulast=Lamers&aufirst=Ilse&auinit=I.&aufull=Lamers+I.&coden=MUSCF&isbn=&pages=1341-1348&date=2013&auinit1=I&auinitm=,Embase,Yes,,,no,Out of scope,,included,
246,"Kuusik, A; Gross-Paju, K; Maamagi, H; Reilent, E",Comparative study of four instrumented mobility analysis tests on neurological disease patients,2014 11TH INTERNATIONAL CONFERENCE ON WEARABLE AND IMPLANTABLE BODY SENSOR NETWORKS WORKSHOPS (BSN WORKSHOPS),2014,"Wearable inertial sensor systems are widely used for the mobility analysis of neurological disease patients. Different assessment methodologies, including - Timed Up and Go, Sit and Stand, walking tests and different sensor configurations are used in practice. Sensor signal processing complexities of competing methods have not been thoroughly investigated. Apparently, computational robustness and noise insensitivity are the key parameters for instrumented mobility monitoring, when automated patient assessment is targeted. This paper describes results of comparisons of 4 different mobility assessment methods conducted on 35 multiple sclerosis patients with variable clinical disability scores. The results demonstrate high variability in inertial sensor signal patterns, even for patients with rather weak disability symptoms. Efficiency of widely used instrumented mobility analysis methodologies is discussed, concluding with the authors' proposals.",Proceedings Paper,10.1109/BSN.WORKSHOPS.2014.13,WOS:000358859200007,WoS,No,Out of scope (topic),,yes,,Conference paper with suffcient data,included,
248,"Reynard, F; Vuadens, P; Deriaz, O; Terrier, P",Could Local Dynamic Stability Serve as an Early Predictor of Falls in Patients with Moderate Neurological Gait Disorders? A Reliability and Comparison Study in Healthy Individuals and in Patients with Paresis of the Lower Extremities,PLOS ONE,2014,"Falls while walking are frequent in patients with muscular dysfunction resulting from neurological disorders. Falls induce injuries that may lead to deconditioning and disabilities, which further increase the risk of falling. Therefore, an early gait stability index would be useful to evaluate patients in order to prevent the occurrence of future falls. Derived from chaos theory, local dynamic stability (LDS), defined by the maximal Lyapunov exponent, assesses the sensitivity of a dynamic system to small perturbations. LDS has already been used for fall risk prediction in elderly people. The aim of the present study was to provide information to facilitate future researches regarding gait stability in patients with neurological gait disorders. The main objectives were 1) to evaluate the intra-session repeatability of LDS in patients and 2) to assess the discriminative power of LDS to differentiate between healthy individuals and neurological patients. Eighty-three patients with mild to moderate neurological disorders associated with paresis of the lower extremities and 40 healthy controls participated in the study. The participants performed 2x30 s walking wearing a 3D accelerometer attached to the lower back, from which 2x35 steps were extracted. LDS was defined as the average exponential rate of divergence among trajectories in a reconstructed state-space that reflected the gait dynamics. LDS assessed along the medio-lateral axis offered the highest repeatability and discriminative power. Intra-session repeatability (intraclass correlation coefficient between the two repetitions) in the patients was 0.89 and the smallest detectable difference was 16%. LDS was substantially lower in the patients than in the controls (33% relative difference, standardized effect size 2.3). LDS measured in short over-ground walking tests seems sufficiently reliable. LDS exhibits good discriminative power to differentiate fall-prone individuals and opens up the possibility of future clinical applications for better prediction of fall risk in neurological patients.",Article,10.1371/JOURNAL.PONE.0100550,WOS:000338276300089,WoS,Yes,,,no,Out of scope,,included,
256,"Kahraman T., Savci S., Coskuner Poyraz E., Ozakbas S., Idiman E.",Factors affecting physical activity in minimally impaired people with multiple sclerosis,Multiple Sclerosis,2014,"Background: Despite the commonly known benefits of physical activity, evidence shows that people with multiple sclerosis (pwMS) are relatively inactive. There are several studies about factors affecting physical activity in pwMS. However, these factors have not investigated in minimally impaired pwMS [Expanded Disability Status Scale (EDSS) scores 0-3.5] who do not have remarkable symptoms and walking disturbance. Objectives: The objective was to determine factors affecting physical activity in minimally impaired pwMS. Methods: Fifty two minimally impaired pwMS (EDSS scores between 0 and 3.5) participated in this cross-sectional study. Physical activity was measured with Godin Leisure-Time Exercise Questionnaire (GLTEQ) and an accelerometer which was used for the 7-day period. Demographic data such as age, gender, body mass index (BMI), and employment status were recorded. Disability level, walking, fatigue, depression, cognitive function and quality of life were measured. Results: Accelerometer counts were correlated with Six-Minute Walk Test (6MWT) (r=0.29, p< 0.05) employment status (r=0.28, p< 0.05), BMI (r=0.34, p< 0.05), and gender (r=0.40, p< .005). GLTEQ was correlated with 6MWT (r=0.46, p< 0.05), Timed 25-Foot Walk (T25FW) (r=-0.50, p< 0.05), International Questionnaire Investigating Quality of Life in MS (r=0.36, p< 0.05), EDSS (r=-0.37, p< 0.05), Fatigue Impact Scale (r=-0.31, p< 0.05), and Beck Depression Inventory (r=-0.32, p< 0.05). Cognitive function (Paced Auditory Serial Addition Test and MS Neuropsychological Questionnaire) was not correlated with physical activity (accelerometer and GLTEQ) (p>0.05). Multiple regression analysis showed that the predictors of physical activity were T25FW (?=-0.422), gender (?=0.371), and BMI (?=0.268). Conclusions: Better walking (speed and endurance), low fatigue and depression levels, male gender and being an employee were related with higher physical activity in minimally impaired pwMS.",Conference Abstract,10.1177/1352458514547846,http://sfx.metabib.ch/sfx_locater?sid=EMBASE&issn=13524585&id=doi:10.1177%2F1352458514547846&atitle=Factors+affecting+physical+activity+in+minimally+impaired+people+with+multiple+sclerosis&stitle=Mult.+Scler.&title=Multiple+Sclerosis&volume=20&issue=1&spage=424&epage=425&aulast=Kahraman&aufirst=T.&auinit=T.&aufull=Kahraman+T.&coden=&isbn=&pages=424-425&date=2014&auinit1=T&auinitm=,Embase,Yes,,,no,Abstract,,Abstract only,
275,"Huisinga, JM; St George, RJ; Spain, R; Overs, S; Horak, FB",Postural Response Latencies Are Related to Balance Control During Standing and Walking in Patients With Multiple Sclerosis,ARCHIVES OF PHYSICAL MEDICINE AND REHABILITATION,2014,"Objective: To understand and examine the relation between postural response latencies obtained during postural perturbations and representative measures of balance during standing (sway variables) and walking (trunk motion). Design: Cross-sectional. Setting: University medical center. Participants: Persons with multiple sclerosis (MS) (n=40) were compared with similar aged control subjects (n=20). There were 20 subjects with MS in the normal walking velocity group and 20 subjects with MS who had slow walking velocity based on a timed 25-foot walk (T25FW) of <5 seconds. Interventions: None. Main Outcome Measures: Postural response latency, sway variables, trunk motion variables. Results: We found that subjects with MS with both slow or normal walking velocities had significantly longer postural response latencies than the healthy control group. Postural response latency was not correlated with the T25FW. Postural response latency was significantly correlated with center of pressure sway variables during quiet standing (root mean square: rho=.334, P=.04; range: rho=.385, P=.017; mean velocity: rho=.337, P=.038; total sway area: rho=.393, P=.015). Postural response latency was also significantly correlated with motion of the trunk during walking (sagittal plane range of motion: rho=.316, P=.05; SD of transverse plane range of motion: rho=-.43, P=.006). Conclusions: These findings clearly indicate that slow postural responses to external perturbations in patients with MS contribute to disturbances in balance control during both standing and walking. (C) 2014 by the American Congress of Rehabilitation Medicine",Article,10.1016/J.APMR.2014.01.004,WOS:000338479700023,WoS,No,Out of scope (topic),,yes,,,Out of scope (topic),"Forceplate & EMG, no wearable (?)"
282,M. Vandermaesen,ReHoblet - A home-based rehabilitation game on the tablet,"2014 IEEE 16th International Conference on e-Health Networking, Applications and Services, Healthcom 2014",2014,NA,Conference Paper,10.1109/HEALTHCOM.2014.7001878,https://www.scopus.com/inward/record.uri?partnerID=HzOxMe3b&scp=84921732967&origin=inward,Scopus,No,Out of scope (topic),,yes,,"Conference paper with sufficient data, tablet technology to assess motor function",Out of scope (topic),"therapeutic game, no diagnostic sensor readings"
287,"Villarejo M.V., García J.M., Zapirain B.G., Zorrilla A.M.",Technological solution for determining gait parametersusing pressure sensors: A case study of multiple sclerosis patients,Bio-Medical Materials and Engineering,2014,"This paper describes a study dealing with a technological solution to measure gait quality in people suffering from multiple sclerosis (MS) by selecting objective parameters that focus on their step. Android mobile technology, online services and four wireless pressure sensors are used in concert for this purpose. The objective of this work is the early detection of deterioration of the patient so that a physician can quickly intervene. Tests were carried out on a group of 8 persons with MS, and these results were compared with a control a group of 6 healthy participants. The results indicated a statistical difference in 7 of 40 general step features, with a minimum ? = 0.013 and a maximum ? = 0.029. These characteristics showed differences between first and fifth metatarsals for each group. It was concluded that these parameters can be used to evaluate gait degeneration in people with MS and that further information could be obtained from measurements with sensors to monitor activities such as bending and inertial sensors.",Conference Paper,10.3233/BME-141177,http://sfx.metabib.ch/sfx_locater?sid=EMBASE&issn=18783619&id=doi:10.3233%2FBME-141177&atitle=Technological+solution+for+determining+gait+parametersusing+pressure+sensors%3A+A+case+study+of+multiple+sclerosis+patients&stitle=Bio-Med.+Mater.+Eng.&title=Bio-Medical+Materials+and+Engineering&volume=24&issue=6&spage=3511&epage=3522&aulast=Villarejo&aufirst=Mar%C3%ADa+Viqueira&auinit=M.V.&aufull=Villarejo+M.V.&coden=BMENE&isbn=&pages=3511-3522&date=2014&auinit1=M&auinitm=V,Embase,No,Out of scope (topic),,yes,,Conference paper with sufficient data,Out of scope (outcomes),sole (bottom of the foot) pressure sensors
292,"Motl R.W., Learmonth Y.C., Pilutti L.A., Dlugonski D., Klaren R.",Validity of minimal clinically important difference values for the multiple sclerosis walking scale-12?,European Neurology,2014,"Background and Objective: Minimal clinically important difference (MCID) values of 4 and 6 points have been proposed for interpreting meaningful change in Multiple Sclerosis Walking Scale-12 (MSWS-12) scores. This study examined the validity of those MCID values based on capturing corresponding changes in other walking outcomes in persons with multiple sclerosis (MS). Methods: On 2 occasions separated by 6 months, 82 persons with MS completed the MSWS-12, timed 25-ft walk (T25FW), 6-min walk (6MW), and gait analysis, and then wore an accelerometer over a 7-day period. We generated change scores for the MSWS-12 and formed groups of stable, worsened, and improved perceived walking based on both 4- and 6-point changes. The groups were compared for corresponding changes in other walking measures over time using mixed-model ANOVAs. Results: The mixed-model ANOVAs did not identify statistically significant group-by-time interactions on the T25FW (p = 0.98 and p = 0.67), the 6MW (p = 0.89 and p = 0.72), gait (p = 0.54 and p = 0.21), or accelerometry (p = 0.40 and p = 0.68) for MCID values of 4- or 6-point changes in MSWS-12 scores. Conclusions: We did not confirm that MCID values of 4 and 6 points for the MSWS-12 correspond with changes in performance, gait, and free-living assessments of walking in MS.",Article,10.1159/000356116,http://sfx.metabib.ch/sfx_locater?sid=EMBASE&issn=14219913&id=doi:10.1159%2F000356116&atitle=Validity+of+minimal+clinically+important+difference+values+for+the+multiple+sclerosis+walking+scale-12%3F&stitle=Eur.+Neurol.&title=European+Neurology&volume=71&issue=3-4&spage=196&epage=202&aulast=Motl&aufirst=Robert+W.&auinit=R.W.&aufull=Motl+R.W.&coden=EUNEA&isbn=&pages=196-202&date=2014&auinit1=R&auinitm=W,Embase,Yes,,,no,Out of scope,,included,accelerometer used as outcome measure
296,"Feldhege F., Mau-Moeller A., Lindner T., Hein A., Markschies A., Zettl U.K., Bader R.",Accuracy of a custom physical activity and knee angle measurement sensor system for patients with neuromuscular disorders and gait abnormalities,"Sensors (Basel, Switzerland)",2015,"Long-term assessment of ambulatory behavior and joint motion are valuable tools for the evaluation of therapy effectiveness in patients with neuromuscular disorders and gait abnormalities. Even though there are several tools available to quantify ambulatory behavior in a home environment, reliable measurement of joint motion is still limited to laboratory tests. The aim of this study was to develop and evaluate a novel inertial sensor system for ambulatory behavior and joint motion measurement in the everyday environment. An algorithm for behavior classification, step detection, and knee angle calculation was developed. The validation protocol consisted of simulated daily activities in a laboratory environment. The tests were performed with ten healthy subjects and eleven patients with multiple sclerosis. Activity classification showed comparable performance to commercially available activPAL sensors. Step detection with our sensor system was more accurate. The calculated flexion-extension angle of the knee joint showed a root mean square error of less than 5° compared with results obtained using an electro-mechanical goniometer. This new system combines ambulatory behavior assessment and knee angle measurement for long-term measurement periods in a home environment. The wearable sensor system demonstrated high validity for behavior classification and knee joint angle measurement in a laboratory setting.",Article,10.3390/S150510734,http://sfx.metabib.ch/sfx_locater?sid=EMBASE&issn=14248220&id=doi:10.3390%2Fs150510734&atitle=Accuracy+of+a+custom+physical+activity+and+knee+angle+measurement+sensor+system+for+patients+with+neuromuscular+disorders+and+gait+abnormalities&stitle=Sensors+%28Basel%29&title=Sensors+%28Basel%2C+Switzerland%29&volume=15&issue=5&spage=10734&epage=10752&aulast=Feldhege&aufirst=Frank&auinit=F.&aufull=Feldhege+F.&coden=&isbn=&pages=10734-10752&date=2015&auinit1=F&auinitm=,Embase,No,Out of scope (topic),,yes,,,Out of scope (outcomes),knee accelerometers range of movement angle
299,"Ayache S.-S., Al-ani T., Farhat W.-H., Zouari H.-G., Créange A., Lefaucheur J.-P.",Analysis of tremor in multiple sclerosis using Hilbert-Huang Transform,Neurophysiologie Clinique,2015,"Tremor is frequently described in patients with multiple sclerosis (MS) but remains poorly characterized using neurophysiological techniques. Accelerometric (ACC) and electromyographic (EMG) recordings were performed in 26 MS patients complaining of clumsiness, associated (n= 16) or not associated (n= 10) with visible tremor. Seventeen healthy subjects with physiological tremor (PT) and eight patients with essential tremor (ET) served as controls. Signals were analyzed using non-linear Empirical Mode Decomposition (EMD) and related Hilbert-Huang Transform (HHT), compared to the standard linear spectral analysis using Fast Fourier Transform (FFT). The presence of cerebellar signs and motor deficit was assessed on clinical examination. Using FFT, tremor was found in all patients with ET and 12% of subjects with PT, but in none of the MS patients, even in the presence of visible tremor. In contrast, EMD-HHT analysis of ACC-EMG coupling showed common frequency peaks characterizing tremor related to a central generator in 62.5% of MS patients with visible tremor, 40% of MS patients without visible tremor, 29% of subjects with PT, and all patients with ET. In EMD-HHT analysis, tremor characteristics were similar in subjects with PT and MS patients, regardless of the presence of a visible tremor, but these characteristics clearly differed in patients with ET. A visible tremor in MS patients was associated with more frequent cerebellar signs and less motor deficit at the upper limb. The low-frequency tremor observed in MS patients could therefore originate in lesions of the brainstem (midbrain) or cerebellothalamic circuits, or may correspond to an enhanced PT, partly favored by cerebellar dysfunction and being more visible during movement execution in the absence of concomitant motor deficit.",Article,10.1016/J.NEUCLI.2015.09.013,http://sfx.metabib.ch/sfx_locater?sid=EMBASE&issn=17697131&id=doi:10.1016%2Fj.neucli.2015.09.013&atitle=Analysis+of+tremor+in+multiple+sclerosis+using+Hilbert-Huang+Transform&stitle=Neurophysiol.+Clin.&title=Neurophysiologie+Clinique&volume=45&issue=6&spage=475&epage=484&aulast=Ayache&aufirst=S.-S.&auinit=S.-S.&aufull=Ayache+S.-S.&coden=NCLIE&isbn=&pages=475-484&date=2015&auinit1=S&auinitm=-S,Embase,Yes,,,no,Out of scope,,Out of scope (outcomes),
302,J. Gong,Causal analysis of inertial body sensors for enhancing gait assessment separability towards multiple sclerosis diagnosis,"2015 IEEE 12th International Conference on Wearable and Implantable Body Sensor Networks, BSN 2015",2015,NA,Conference Paper,10.1109/BSN.2015.7299400,https://www.scopus.com/inward/record.uri?partnerID=HzOxMe3b&scp=84961661992&origin=inward,Scopus,No,Out of scope (topic),,yes,,,Out of scope (outcomes),
306,J. Gong,Correlations between inertial body sensor measures and clinical measures in multiple sclerosis,BodyNets International Conference on Body Area Networks,2015,NA,Conference Paper,10.4108/EAI.28-9-2015.2261504,https://www.scopus.com/inward/record.uri?partnerID=HzOxMe3b&scp=85052172659&origin=inward,Scopus,No,Out of scope (topic),,yes,,Conference paper with sufficient data,included,causality index (5 accelerometers)
307,J. Havlík,Design and realization of measuring device for tremor evaluation,"2015 International Workshop on Computational Intelligence for Multimedia Understanding, IWCIM 2015",2015,NA,Conference Paper,10.1109/IWCIM.2015.7347079,https://www.scopus.com/inward/record.uri?partnerID=HzOxMe3b&scp=84962911372&origin=inward,Scopus,No,Out of scope (outcomes)/Teamdiscussion,https://ieeexplore.ieee.org/document/7347079,yes,,Conference paper with sufficient data,Out of scope (outcomes),
314,R. Motl,Does the effect of a physical activity behavioral intervention vary by characteristics of people with multiple sclerosis?,International Journal of MS Care,2015,NA,Article,10.7224/1537-2073.2014-016,https://www.scopus.com/inward/record.uri?partnerID=HzOxMe3b&scp=84928678568&origin=inward,Scopus,No,Out of scope (topic),,yes,,,included,accelerometer used as outcome measure
